Date,Feedback,tokens,Normalized_Feedback,Punctuation_Removal,Remove_stop_words,Lematization,Clean_data,Label,Numeric_Label,Compound_Score
04-Aug-24,hand still shake iselco annoy,"['the', 'hands', 'are', 'still', 'shaking', '.', 'iselco', 'is', 'annoying']","['the', 'hands', 'are', 'still', 'shaking', '.', 'iselco', 'is', 'annoying']",the hands are still shaking  iselco is annoying,hands still shaking iselco annoying,hand still shake iselco annoy,hand still shake iselco annoy,Negative,1,-0.1027
04-Aug-24,always spare problem like line trip fix immediately,"['They', 'should', 'always', 'have', 'a', 'spare', '.', 'For', 'when', 'there', 'is', 'a', 'problem', 'like', 'line', 'tripping', ',', 'they', 'can', 'fix', 'it', 'immediately', '.']","['they', 'should', 'always', 'have', 'a', 'spare', '.', 'for', 'when', 'there', 'is', 'a', 'problem', 'like', 'line', 'tripping', ',', 'they', 'can', 'fix', 'it', 'immediately', '.']",they should always have a spare  for when there is a problem like line tripping  they can fix it immediately ,always spare problem like line tripping fix immediately,always spare problem like line trip fix immediately,always spare problem like line trip fix immediately,Neutral,2,-0.0516
04-Aug-24,iselco really insult,"['Iselco', 'you', 'are', 'really', 'insulting', '!']","['iselco', 'you', 'are', 'really', 'insulting', '!']",iselco you are really insulting ,iselco really insulting,iselco really insult,iselco really insult,Negative,1,-0.5563
04-Aug-24,thank consistent support make difference community,"['Thank', 'you', 'for', 'your', 'consistent', 'support', ';', 'it', 'makes', 'a', 'difference', 'in', 'our', 'community', '.']","['thank', 'you', 'for', 'your', 'consistent', 'support', ';', 'it', 'makes', 'a', 'difference', 'in', 'our', 'community', '.']",thank you for your consistent support  it makes a difference in our community ,thank consistent support makes difference community,thank consistent support make difference community,thank consistent support make difference community,Positive,0,0.6369
04-Aug-24,thanks update iselco,"['Thanks', 'for', 'update', 'ISELCO']","['thanks', 'for', 'update', 'iselco']",thanks for update iselco,thanks update iselco,thanks update iselco,thanks update iselco,Positive,0,0.4404
04-Aug-24,one announce brownout,"['The', 'one', 'they', 'announced', 'but', 'it', 'is', 'brownout']","['the', 'one', 'they', 'announced', 'but', 'it', 'is', 'brownout']",the one they announced but it is brownout,one announced brownout,one announce brownout,one announce brownout,Neutral,2,0
04-Aug-24,hey electricity bill big always brown hot iselco,"['Hey', ',', 'your', 'electricity', 'bill', 'is', 'big', ',', 'it', 'is', 'always', 'brown', 'out', '.', 'It', 'is', 'so', 'hot', ',', 'Iselco']","['hey', ',', 'your', 'electricity', 'bill', 'is', 'big', ',', 'it', 'is', 'always', 'brown', 'out', '.', 'it', 'is', 'so', 'hot', ',', 'iselco']",hey  your electricity bill is big  it is always brown out  it is so hot  iselco,hey electricity bill big always brown hot iselco,hey electricity bill big always brown hot iselco,hey electricity bill big always brownout hot iselco,Negative,1,0
04-Aug-24,post last night not like post power interruption,"['You', 'should', 'have', 'posted', 'last', 'night', ',', 'not', 'like', 'that', ',', 'just', 'now', 'post', 'a', 'power', 'interruption']","['you', 'should', 'have', 'posted', 'last', 'night', ',', 'not', 'like', 'that', ',', 'just', 'now', 'post', 'a', 'power', 'interruption']",you should have posted last night  not like that  just now post a power interruption,posted last night not like post power interruption,post last night not like post power interruption,post last night not like post power interruption,Neutral,2,-0.5588
04-Aug-24,terrible iselco love charge electricity always,"['You', 'are', 'terrible', 'Iselco', ',', 'you', 'love', 'to', 'charge', ',', 'the', 'electricity', 'is', 'always', 'off']","['you', 'are', 'terrible', 'iselco', ',', 'you', 'love', 'to', 'charge', ',', 'the', 'electricity', 'is', 'always', 'off']",you are terrible iselco  you love to charge  the electricity is always off,terrible iselco love charge electricity always,terrible iselco love charge electricity always,terrible iselco love charge electricity always,Negative,1,0.2732
05-Aug-24,not friday yet brownout quality service really reliable good job,"['It', 'is', 'not', 'Friday', 'yet', ',', 'but', 'this', 'is', 'a', 'brownout', ',', 'the', 'quality', 'service', 'is', 'really', 'very', 'reliable', ',', 'good', 'job', '!']","['it', 'is', 'not', 'friday', 'yet', ',', 'but', 'this', 'is', 'a', 'brownout', ',', 'the', 'quality', 'service', 'is', 'really', 'very', 'reliable', ',', 'good', 'job', '!']",it is not friday yet  but this is a brownout  the quality service is really very reliable  good job ,not friday yet brownout quality service really reliable good job,not friday yet brownout quality service really reliable good job,not friday yet brownout quality service really reliable good job,Positive,0,0.4902
06-Aug-24,thank quick repair electricity,"['Thank', 'you', 'for', 'the', 'quick', 'repair', 'of', 'electricity']","['thank', 'you', 'for', 'the', 'quick', 'repair', 'of', 'electricity']",thank you for the quick repair of electricity,thank quick repair electricity,thank quick repair electricity,thank quick repair electricity,Positive,0,0.3612
07-Aug-24,life get harder harder,"['Life', 'is', 'getting', 'harder', 'and', 'harder']","['life', 'is', 'getting', 'harder', 'and', 'harder']",life is getting harder and harder,life getting harder harder,life get harder harder,life get harder harder,Negative,1,0
08-Aug-24,still low voltage poor client not know test poor appliance,"['You', 'are', 'still', 'low', 'voltage', ',', 'poor', 'clients', 'who', 'do', 'not', 'know', 'how', 'to', 'test', ',', 'poor', 'appliances']","['you', 'are', 'still', 'low', 'voltage', ',', 'poor', 'clients', 'who', 'do', 'not', 'know', 'how', 'to', 'test', ',', 'poor', 'appliances']",you are still low voltage  poor clients who do not know how to test  poor appliances,still low voltage poor clients not know test poor appliances,still low voltage poor client not know test poor appliance,still low voltage poor client not know test poor appliance,Negative,1,-0.3911
08-Aug-24,yellow red alert ngcp substation manual load drop,"['No', 'yellow', 'or', 'red', 'alert', 'from', 'ngcp', '.', 'The', 'only', 'substation', 'that', 'does', 'manual', 'load', 'dropping', '.']","['no', 'yellow', 'or', 'red', 'alert', 'from', 'ngcp', '.', 'the', 'only', 'substation', 'that', 'does', 'manual', 'load', 'dropping', '.']",no yellow or red alert from ngcp  the only substation that does manual load dropping ,yellow red alert ngcp substation manual load dropping,yellow red alert ngcp substation manual load drop,yellow red alert ngcp substation manual load drop,Neutral,2,0.0258
08-Aug-24,output outlet low low voltage difficult cool air conditioner destroy thing,"['The', 'output', 'of', 'our', 'outlet', 'is', 'low', '.', 'You', 'are', 'LOW', 'Voltage', 'again', ',', 'so', 'it', 'is', 'very', 'difficult', 'to', 'cool', 'our', 'air', 'conditioner', ',', 'you', 'will', 'just', 'destroy', 'our', 'things']","['the', 'output', 'of', 'our', 'outlet', 'is', 'low', '.', 'you', 'are', 'low', 'voltage', 'again', ',', 'so', 'it', 'is', 'very', 'difficult', 'to', 'cool', 'our', 'air', 'conditioner', ',', 'you', 'will', 'just', 'destroy', 'our', 'things']",the output of our outlet is low  you are low voltage again  so it is very difficult to cool our air conditioner  you will just destroy our things,output outlet low low voltage difficult cool air conditioner destroy things,output outlet low low voltage difficult cool air conditioner destroy thing,output outlet low low voltage difficult cool air conditioner destroy thing,Negative,1,-0.7845
08-Aug-24,national grid corporation philippine please investigate,"['National', 'Grid', 'Corporation', 'of', 'the', 'Philippines', '?', 'please', 'investigate', '.']","['national', 'grid', 'corporation', 'of', 'the', 'philippines', '?', 'please', 'investigate', '.']",national grid corporation of the philippines  please investigate ,national grid corporation philippines please investigate,national grid corporation philippine please investigate,national grid corporation philippine please investigate,Neutral,2,0.3182
09-Aug-24,think browning night do afternoon still night,"['Why', 'did', 'you', 'think', 'of', 'browning', 'out', 'at', 'night', ',', 'it', 'can', 'be', 'done', 'all', 'afternoon', ',', 'why', 'is', 'it', 'still', 'night', '?']","['why', 'did', 'you', 'think', 'of', 'browning', 'out', 'at', 'night', ',', 'it', 'can', 'be', 'done', 'all', 'afternoon', ',', 'why', 'is', 'it', 'still', 'night', '?']",why did you think of browning out at night  it can be done all afternoon  why is it still night ,think browning night done afternoon still night,think browning night do afternoon still night,think brownout night do afternoon still night,Neutral,2,0
09-Aug-24,viable electrecity since marcos senior,"['Viable', 'electrecity', 'since', 'Marcos', 'senior']","['viable', 'electrecity', 'since', 'marcos', 'senior']",viable electrecity since marcos senior,viable electrecity since marcos senior,viable electrecity since marcos senior,viable electrecity since marcos senior,Positive,0,0
09-Aug-24,electricity turn minante ago,"['Electricity', 'was', 'turned', 'off', 'here', 'in', 'Minante', 'a', 'while', 'ago']","['electricity', 'was', 'turned', 'off', 'here', 'in', 'minante', 'a', 'while', 'ago']",electricity was turned off here in minante a while ago,electricity turned minante ago,electricity turn minante ago,electricity turn minante ago,Neutral,2,0
09-Aug-24,gosh brown always mistake even early morning,"['Gosh', ',', 'brown', 'out', 'again', ',', 'you', 'always', 'have', 'no', 'mistakes', ',', 'even', 'in', 'the', 'early', 'morning']","['gosh', ',', 'brown', 'out', 'again', ',', 'you', 'always', 'have', 'no', 'mistakes', ',', 'even', 'in', 'the', 'early', 'morning']",gosh  brown out again  you always have no mistakes  even in the early morning,gosh brown always mistakes even early morning,gosh brown always mistake even early morning,gosh brownout always mistake even early morning,Negative,1,-0.34
09-Aug-24,power every morning,"['Is', 'there', 'no', 'power', 'every', 'morning', '?']","['is', 'there', 'no', 'power', 'every', 'morning', '?']",is there no power every morning ,power every morning,power every morning,power every morning,Negative,1,0
09-Aug-24,unorganized order,"['Unorganized', 'order']","['unorganized', 'order']",unorganized order,unorganized order,unorganized order,unorganized order,Negative,1,0
09-Aug-24,think sacrifice line men fix power line not know hard work let u patient brother,"['Think', 'about', 'the', 'sacrifice', 'of', 'the', 'line', 'men', ',', 'just', 'to', 'fix', 'our', 'power', 'line', ',', 'you', 'do', 'not', 'know', 'how', 'hard', 'their', 'work', 'is', 'so', 'let', 'us', 'be', 'patient', 'brothers']","['think', 'about', 'the', 'sacrifice', 'of', 'the', 'line', 'men', ',', 'just', 'to', 'fix', 'our', 'power', 'line', ',', 'you', 'do', 'not', 'know', 'how', 'hard', 'their', 'work', 'is', 'so', 'let', 'us', 'be', 'patient', 'brothers']",think about the sacrifice of the line men  just to fix our power line  you do not know how hard their work is so let us be patient brothers,think sacrifice line men fix power line not know hard work let us patient brothers,think sacrifice line men fix power line not know hard work let u patient brother,think sacrifice line men fix power line not know hard work let u patient brother,Positive,0,0.0762
09-Aug-24,brownout problem long time,"['brownout', 'has', 'been', 'a', 'problem', 'for', 'a', 'long', 'time', '.']","['brownout', 'has', 'been', 'a', 'problem', 'for', 'a', 'long', 'time', '.']",brownout has been a problem for a long time ,brownout problem long time,brownout problem long time,brownout problem long time,Negative,1,-0.4019
09-Aug-24,let u not complain brownout not even know damage,"['Let', 'us', 'not', 'complain', 'if', 'it', 'brownout', '.', 'because', 'they', 'do', 'not', 'even', 'know', 'where', 'the', 'damage', 'is']","['let', 'us', 'not', 'complain', 'if', 'it', 'brownout', '.', 'because', 'they', 'do', 'not', 'even', 'know', 'where', 'the', 'damage', 'is']",let us not complain if it brownout  because they do not even know where the damage is,let us not complain brownout not even know damage,let u not complain brownout not even know damage,let us not complain brownout not even know damage,Neutral,2,0.5773
10-Aug-24,hope also explain cause electric shock iselco,"['I', 'hope', 'you', 'will', 'also', 'explain', 'the', 'cause', 'of', 'the', 'electric', 'shock', 'of', 'Iselco']","['i', 'hope', 'you', 'will', 'also', 'explain', 'the', 'cause', 'of', 'the', 'electric', 'shock', 'of', 'iselco']",i hope you will also explain the cause of the electric shock of iselco,hope also explain cause electric shock iselco,hope also explain cause electric shock iselco,hope also explain cause electric shock iselco,Neutral,2,0.0772
11-Aug-24,thank u much iselco,"['Thank', 'u', 'so', 'much', 'iselco']","['thank', 'u', 'so', 'much', 'iselco']",thank u so much iselco,thank u much iselco,thank u much iselco,thank u much iselco,Positive,0,0.3612
11/08/2024,thank much really appreciate iselco,"['Thank', 'you', 'so', 'much', 'I', 'really', 'appreciate', 'it', 'ISELCO']","['thank', 'you', 'so', 'much', 'i', 'really', 'appreciate', 'it', 'iselco']",thank you so much i really appreciate it iselco,thank much really appreciate iselco,thank much really appreciate iselco,thank much really appreciate iselco,Positive,0,0.6697
12-Aug-24,people iselco please check record carefully come disconnection notice fail pay,"['People', 'from', 'Iselco', ',', 'please', 'check', 'your', 'record', 'carefully', '.', 'How', 'come', 'we', 'have', 'a', 'disconnection', 'notice', 'when', 'we', 'failed', 'to', 'pay', '.']","['people', 'from', 'iselco', ',', 'please', 'check', 'your', 'record', 'carefully', '.', 'how', 'come', 'we', 'have', 'a', 'disconnection', 'notice', 'when', 'we', 'failed', 'to', 'pay', '.']",people from iselco  please check your record carefully  how come we have a disconnection notice when we failed to pay ,people iselco please check record carefully come disconnection notice failed pay,people iselco please check record carefully come disconnection notice fail pay,people iselco please check record carefully come disconnection notice fail pay,Negative,1,-0.2732
12-Aug-24,please fix service,"['Please', 'fix', 'your', 'service']","['please', 'fix', 'your', 'service']",please fix your service,please fix service,please fix service,please fix service,Negative,1,0.3182
12-Aug-24,staff iselco always willing go extra mile,"['The', 'staff', 'at', 'ISELCO', 'are', 'always', 'willing', 'to', 'go', 'the', 'extra', 'mile', '.']","['the', 'staff', 'at', 'iselco', 'are', 'always', 'willing', 'to', 'go', 'the', 'extra', 'mile', '.']",the staff at iselco are always willing to go the extra mile ,staff iselco always willing go extra mile,staff iselco always willing go extra mile,staff iselco always willing go extra mile,Positive,0,0
12-Aug-24,service quality decrease significantly past month,"['The', 'service', 'quality', 'has', 'decreased', 'significantly', 'over', 'the', 'past', 'few', 'months', '.']","['the', 'service', 'quality', 'has', 'decreased', 'significantly', 'over', 'the', 'past', 'few', 'months', '.']",the service quality has decreased significantly over the past few months ,service quality decreased significantly past months,service quality decrease significantly past month,service quality decrease significantly past month,Negative,1,0
12-Aug-24,lack transparency billing process concern confuse,"['The', 'lack', 'of', 'transparency', 'in', 'the', 'billing', 'process', 'is', 'concerning', 'and', 'confusing', '.']","['the', 'lack', 'of', 'transparency', 'in', 'the', 'billing', 'process', 'is', 'concerning', 'and', 'confusing', '.']",the lack of transparency in the billing process is concerning and confusing ,lack transparency billing process concerning confusing,lack transparency billing process concern confuse,lack transparency billing process concern confuse,Negative,1,-0.4939
14-Aug-24,fix service first pay improvement service go destroy thing power interruption suck,"['Fix', 'your', 'service', 'first', 'before', 'paying', '.', 'there', 'is', 'no', 'improvement', 'in', 'the', 'service', ',', 'you', 'are', 'going', 'to', 'destroy', 'things', 'because', 'of', 'that', 'power', 'interruption', ',', 'it', 'sucks', '!']","['fix', 'your', 'service', 'first', 'before', 'paying', '.', 'there', 'is', 'no', 'improvement', 'in', 'the', 'service', ',', 'you', 'are', 'going', 'to', 'destroy', 'things', 'because', 'of', 'that', 'power', 'interruption', ',', 'it', 'sucks', '!']",fix your service first before paying  there is no improvement in the service  you are going to destroy things because of that power interruption  it sucks ,fix service first paying improvement service going destroy things power interruption sucks,fix service first pay improvement service go destroy thing power interruption suck,fix service first pay improvement service go destroy thing power interruption suck,Negative,1,-0.743
15-Aug-24,iselco bad play electricity,"['Iselco', 'is', 'so', 'bad', ',', 'you', 'are', 'playing', 'with', 'the', 'electricity']","['iselco', 'is', 'so', 'bad', ',', 'you', 'are', 'playing', 'with', 'the', 'electricity']",iselco is so bad  you are playing with the electricity,iselco bad playing electricity,iselco bad play electricity,iselco bad play electricity,Negative,1,-0.2732
16-Aug-24,pay enough service not good enough,"['Paying', 'enough', 'but', 'service', 'is', 'not', 'good', 'enough']","['paying', 'enough', 'but', 'service', 'is', 'not', 'good', 'enough']",paying enough but service is not good enough,paying enough service not good enough,pay enough service not good enough,pay enough service not good enough,Negative,1,-0.4226
16-Aug-24,customer service representative always attentive need,"['The', 'customer', 'service', 'representatives', 'are', 'always', 'attentive', 'to', 'my', 'needs', '.']","['the', 'customer', 'service', 'representatives', 'are', 'always', 'attentive', 'to', 'my', 'needs', '.']",the customer service representatives are always attentive to my needs ,customer service representatives always attentive needs,customer service representative always attentive need,customer service representative always attentive need,Positive,0,0
16-Aug-24,lack communication regard schedule maintenance concern,"['The', 'lack', 'of', 'communication', 'regarding', 'scheduled', 'maintenance', 'is', 'concerning', '.']","['the', 'lack', 'of', 'communication', 'regarding', 'scheduled', 'maintenance', 'is', 'concerning', '.']",the lack of communication regarding scheduled maintenance is concerning ,lack communication regarding scheduled maintenance concerning,lack communication regard schedule maintenance concern,lack communication regard schedule maintenance concern,Negative,1,-0.3182
16-Aug-24,iselco many people affected especially work due power interruption,"['Iselco', ',', 'many', 'people', 'are', 'affected', 'especially', 'our', 'work', 'due', 'to', 'power', 'interruption']","['iselco', ',', 'many', 'people', 'are', 'affected', 'especially', 'our', 'work', 'due', 'to', 'power', 'interruption']",iselco  many people are affected especially our work due to power interruption,iselco many people affected especially work due power interruption,iselco many people affected especially work due power interruption,iselco many people affected especially work due power interruption,Negative,1,-0.4767
16-Aug-24,thanks iselco information hope fix soon,"['Thanks', 'Iselco', 'for', 'the', 'information', '.', 'I', 'hope', 'it', 'will', 'be', 'fixed', 'soon']","['thanks', 'iselco', 'for', 'the', 'information', '.', 'i', 'hope', 'it', 'will', 'be', 'fixed', 'soon']",thanks iselco for the information  i hope it will be fixed soon,thanks iselco information hope fixed soon,thanks iselco information hope fix soon,thanks iselco information hope fix soon,Positive,0,0.7003
16-Aug-24,power return immediately congratulation,"['The', 'power', 'returned', 'immediately', '.', 'Congratulations']","['the', 'power', 'returned', 'immediately', '.', 'congratulations']",the power returned immediately  congratulations,power returned immediately congratulations,power return immediately congratulation,power return immediately congratulation,Positive,0,0.5994
18-Aug-24,fix service charge terrible,"['Fix', 'your', 'service', '.', 'When', 'you', 'charge', ',', 'it', 'is', 'terrible']","['fix', 'your', 'service', '.', 'when', 'you', 'charge', ',', 'it', 'is', 'terrible']",fix your service  when you charge  it is terrible,fix service charge terrible,fix service charge terrible,fix service charge terrible,Negative,1,-0.4767
18-Aug-24,else expect rotten service,"['What', 'else', 'can', 'we', 'expect', 'from', 'your', 'rotten', 'service', '?']","['what', 'else', 'can', 'we', 'expect', 'from', 'your', 'rotten', 'service', '?']",what else can we expect from your rotten service ,else expect rotten service,else expect rotten service,else expect rotten service,Negative,1,-0.5106
19-Aug-24,finish reading brownout right away,"['You', 'just', 'finished', 'reading', 'brownout', 'right', 'away']","['you', 'just', 'finished', 'reading', 'brownout', 'right', 'away']",you just finished reading brownout right away,finished reading brownout right away,finish reading brownout right away,finish reading brownout right away,Negative,1,0
19-Aug-24,even eye darken iselco,"['Even', 'my', 'eyes', 'are', 'darkening', 'for', 'you', 'iselco']","['even', 'my', 'eyes', 'are', 'darkening', 'for', 'you', 'iselco']",even my eyes are darkening for you iselco,even eyes darkening iselco,even eye darken iselco,even eye darken iselco,Negative,1,0
20-Aug-24,update might surprised suddenly brownout,"['No', 'update', ',', 'I', 'might', 'be', 'surprised', 'that', 'it', 'is', 'suddenly', 'brownout', 'again']","['no', 'update', ',', 'i', 'might', 'be', 'surprised', 'that', 'it', 'is', 'suddenly', 'brownout', 'again']",no update  i might be surprised that it is suddenly brownout again,update might surprised suddenly brownout,update might surprised suddenly brownout,update might surprised suddenly brownout,Negative,1,0.2263
20-Aug-24,still feel like raise bill good service good always brownout,"['You', 'still', 'feel', 'like', 'raising', 'the', 'bill', ',', 'it', 'is', 'good', 'if', 'your', 'service', 'is', 'good', '.', 'It', 'is', 'always', 'brownout', 'here', '.']","['you', 'still', 'feel', 'like', 'raising', 'the', 'bill', ',', 'it', 'is', 'good', 'if', 'your', 'service', 'is', 'good', '.', 'it', 'is', 'always', 'brownout', 'here', '.']",you still feel like raising the bill  it is good if your service is good  it is always brownout here ,still feel like raising bill good service good always brownout,still feel like raise bill good service good always brownout,still feel like raise bill good service good always brownout,Negative,1,0.8074
20-Aug-24,bill really increase supply dead appliance still destroyed,"['the', 'bill', 'will', 'really', 'increase', 'now', 'because', 'their', 'supply', 'is', 'dead', ',', 'appliances', 'are', 'still', 'being', 'destroyed']","['the', 'bill', 'will', 'really', 'increase', 'now', 'because', 'their', 'supply', 'is', 'dead', ',', 'appliances', 'are', 'still', 'being', 'destroyed']",the bill will really increase now because their supply is dead  appliances are still being destroyed,bill really increase supply dead appliances still destroyed,bill really increase supply dead appliance still destroyed,bill really increase supply dead appliance still destroyed,Negative,1,-0.7328
20-Aug-24,bill keep go,"['The', 'bill', 'keeps', 'going', 'up', 'and', 'up']","['the', 'bill', 'keeps', 'going', 'up', 'and', 'up']",the bill keeps going up and up,bill keeps going,bill keep go,bill keep go,Negative,1,0
20-Aug-24,charge high service rotten,"['The', 'charge', 'is', 'high', ',', 'your', 'service', 'is', 'rotten']","['the', 'charge', 'is', 'high', ',', 'your', 'service', 'is', 'rotten']",the charge is high  your service is rotten,charge high service rotten,charge high service rotten,charge high service rotten,Negative,1,-0.5106
20-Aug-24,service not change like brownout poor kid annoy,"['their', 'service', 'has', 'not', 'changed', 'like', 'now', 'it', 'is', 'brownout', 'again', '!', 'poor', 'kids', ',', 'it', 'is', 'annoying']","['their', 'service', 'has', 'not', 'changed', 'like', 'now', 'it', 'is', 'brownout', 'again', '!', 'poor', 'kids', ',', 'it', 'is', 'annoying']",their service has not changed like now it is brownout again  poor kids  it is annoying,service not changed like brownout poor kids annoying,service not change like brownout poor kid annoy,service not change like brownout poor kid annoy,Negative,1,-0.797
20-Aug-24,nothing do raise charge hidden former manager chase,"['Nothing', 'was', 'done', 'but', 'to', 'raise', 'the', 'charge', '.', 'The', 'hidden', 'former', 'manager', 'should', 'be', 'chased']","['nothing', 'was', 'done', 'but', 'to', 'raise', 'the', 'charge', '.', 'the', 'hidden', 'former', 'manager', 'should', 'be', 'chased']",nothing was done but to raise the charge  the hidden former manager should be chased,nothing done raise charge hidden former manager chased,nothing do raise charge hidden former manager chase,nothing do raise charge hidden former manager chase,Negative,1,0
