Date,Feedback,tokens,Normalized_Feedback,Punctuation_Removal,Remove_stop_words,Lematization,Clean_data,Label,Numeric_Label,Compound_Score
2020,good service,"['Good', 'service']","['good', 'service']",good service,good service,good service,good service,Positive,0,0.4404
2021,second bill double normal electric bill paperwork something not right,"['My', 'second', 'bill', 'was', 'double', 'the', 'normal', 'electric', 'bill', 'and', 'no', 'paperwork', ',', 'something', 'is', 'not', 'right']","['my', 'second', 'bill', 'was', 'double', 'the', 'normal', 'electric', 'bill', 'and', 'no', 'paperwork', ',', 'something', 'is', 'not', 'right']",my second bill was double the normal electric bill and no paperwork  something is not right,second bill double normal electric bill paperwork something not right,second bill double normal electric bill paperwork something not right,second bill double normal electric bill paperwork something not right,Negative,1,0
2021,poor service almost twenty brownout one day,"['Very', 'poor', 'service', ',', 'almost', 'twenty', 'brownout', 'in', 'one', 'day']","['very', 'poor', 'service', ',', 'almost', 'twenty', 'brownout', 'in', 'one', 'day']",very poor service  almost twenty brownout in one day,poor service almost twenty brownout one day,poor service almost twenty brownout one day,poor service almost twenty brownout one day,Negative,1,-0.4767
2022,power interruption without sign problem power line,"['Power', 'interruptions', 'without', 'any', 'sign', 'of', 'problem', 'with', 'power', 'lines', '.']","['power', 'interruptions', 'without', 'any', 'sign', 'of', 'problem', 'with', 'power', 'lines', '.']",power interruptions without any sign of problem with power lines ,power interruptions without sign problem power lines,power interruption without sign problem power line,power interruption without sign problem power line,Negative,1,-0.0624
2022,number hotlines not answer,"['The', 'number', 'on', 'your', 'hotlines', 'are', 'not', 'answering', '.']","['the', 'number', 'on', 'your', 'hotlines', 'are', 'not', 'answering', '.']",the number on your hotlines are not answering ,number hotlines not answering,number hotlines not answer,number hotlines not answer,Negative,1,0.0772
2023,friendly office,"['Friendly', 'office']","['friendly', 'office']",friendly office,friendly office,friendly office,friendly office,Positive,0,0.4939
2023,bad service not update member consumer conduct power interruption,"['Worst', 'service', 'of', 'all', '.', 'You', 'do', 'not', 'update', 'member', 'consumers', 'when', 'conducting', 'power', 'interruption']","['worst', 'service', 'of', 'all', '.', 'you', 'do', 'not', 'update', 'member', 'consumers', 'when', 'conducting', 'power', 'interruption']",worst service of all  you do not update member consumers when conducting power interruption,worst service not update member consumers conducting power interruption,bad service not update member consumer conduct power interruption,bad service not update member consumer conduct power interruption,Negative,1,-0.7184
2023,corrupt company greedy bad service government need improve,"['Corrupt', 'company', ',', 'greedy', ',', 'bad', 'services', ',', 'the', 'government', 'needs', 'to', 'improve', 'this']","['corrupt', 'company', ',', 'greedy', ',', 'bad', 'services', ',', 'the', 'government', 'needs', 'to', 'improve', 'this']",corrupt company  greedy  bad services  the government needs to improve this,corrupt company greedy bad services government needs improve,corrupt company greedy bad service government need improve,corrupt company greedy bad service government need improve,Negative,1,-0.4404
2023,terrible conductor electricity,"['Very', 'terrible', 'conductor', 'of', 'electricity']","['very', 'terrible', 'conductor', 'of', 'electricity']",very terrible conductor of electricity,terrible conductor electricity,terrible conductor electricity,terrible conductor electricity,Negative,1,-0.4767
31-Oct-18,service rotten poor consumer,"['the', 'service', 'is', 'very', 'rotten', 'poor', 'consumers', '.']","['the', 'service', 'is', 'very', 'rotten', 'poor', 'consumers', '.']",the service is very rotten poor consumers ,service rotten honest poor consumers,service rotten poor consumer,service rotten poor consumer,Negative,1,-0.7506
31-Oct-18,lot job iselco hope always prioritize safety consumer,"['there', 'are', 'a', 'lot', 'of', 'jobs', 'of', 'Iselco', ',', 'but', 'I', 'hope', 'they', 'always', 'prioritize', 'the', 'safety', 'of', 'consumers', '.']","['there', 'are', 'a', 'lot', 'of', 'jobs', 'of', 'iselco', ',', 'but', 'i', 'hope', 'they', 'always', 'prioritize', 'the', 'safety', 'of', 'consumers', '.']",there are a lot of jobs of iselco  but i hope they always prioritize the safety of consumers ,lot jobs iselco hope always prioritize safety consumers,lot job iselco hope always prioritize safety consumer,lot job iselco hope always prioritize safety consumer,Positive,0,0.6908
31-Oct-18,linemen pass afternoon say come back nothing,"['Your', 'linemen', 'passed', 'by', 'this', 'afternoon', '.', 'They', 'said', 'they', 'will', 'come', 'back', 'but', 'nothing', '.']","['your', 'linemen', 'passed', 'by', 'this', 'afternoon', '.', 'they', 'said', 'they', 'will', 'come', 'back', 'but', 'nothing', '.']",your linemen passed by this afternoon  they said they will come back but nothing ,linemen passed afternoon said come back nothing,linemen pass afternoon say come back nothing,linemen pass afternoon say come back nothing,Negative,1,0
31-Oct-18,thank iselco,"['Thank', 'you', ',', 'Iselco', '!']","['thank', 'you', ',', 'iselco', '!']",thank you  iselco ,thank iselco,thank iselco,thank iselco,Positive,0,0.3612
31-Oct-18,thank much iselco immediate light barangay,"['Thank', 'you', 'very', 'much', 'Iselco', 'for', 'the', 'immediate', 'lighting', 'of', 'our', 'barangay']","['thank', 'you', 'very', 'much', 'iselco', 'for', 'the', 'immediate', 'lighting', 'of', 'our', 'barangay']",thank you very much iselco for the immediate lighting of our barangay,thank much iselco immediate lighting barangay,thank much iselco immediate light barangay,thank much iselco immediate light barangay,Positive,0,0.3612
31-Oct-18,power outage day,"['no', 'electricity', 'for', 'days']","['power', 'outage', 'for', 'days']",power outage for days,power outage days,power outage day,power outage day,Negative,1,0
31-Oct-18,thanks iselco quick action take care godbless,"['Thanks', 'iselco', 'for', 'the', 'quick', 'action', '!', 'Take', 'care', '.', 'Godbless']","['thanks', 'iselco', 'for', 'the', 'quick', 'action', '!', 'take', 'care', '.', 'godbless']",thanks iselco for the quick action  take care  godbless,thanks iselco quick action take care godbless,thanks iselco quick action take care godbless,thanks iselco quick action take care godbless,Positive,0,0.7269
31-Oct-18,hope electricity come back soon,"['I', 'hope', 'the', 'electricity', 'will', 'come', 'back', 'soon']","['i', 'hope', 'the', 'electricity', 'will', 'come', 'back', 'soon']",i hope the electricity will come back soon,hope electricity come back soon,hope electricity come back soon,hope electricity come back soon,Neutral,2,0.4404
31-Oct-18,no elecricity yet,"['There', 'is', 'no', 'elecricity', 'yet']","['there', 'is', 'no', 'elecricity', 'yet']",there is no elecricity yet,elecricity yet,no elecricity yet,no elecricity yet,Negative,1,-0.296
31-Oct-18,thank much linemen work overtime,"['Thank', 'you', 'very', 'much', 'to', 'the', 'Linemen', 'who', 'worked', 'overtime']","['thank', 'you', 'very', 'much', 'to', 'the', 'linemen', 'who', 'worked', 'overtime']",thank you very much to the linemen who worked overtime,thank much linemen worked overtime,thank much linemen work overtime,thank much linemen work overtime,Positive,0,0.3612
31-Oct-18,thank much iselco do good job god bless,"['Thank', 'you', 'very', 'much', 'ISELCO', '.', 'You', 'have', 'done', 'good', 'jobs', '!', 'God', 'bless', '!']","['thank', 'you', 'very', 'much', 'iselco', '.', 'you', 'have', 'done', 'good', 'jobs', '!', 'god', 'bless', '!']",thank you very much iselco  you have done good jobs  god bless ,thank much iselco done good jobs god bless,thank much iselco do good job god bless,thank much iselco do good job god bless,Positive,0,0.8519
31-Oct-18,thank iselco always safe life safety important anything else,"['Thank', 'you', 'iselco', '.', 'Always', 'be', 'safe', '.', 'Your', 'life', 'and', 'safety', 'are', 'more', 'important', 'than', 'anything', 'else', '.']","['thank', 'you', 'iselco', '.', 'always', 'be', 'safe', '.', 'your', 'life', 'and', 'safety', 'are', 'more', 'important', 'than', 'anything', 'else', '.']",thank you iselco  always be safe  your life and safety are more important than anything else ,thank iselco always safe life safety important anything else,thank iselco always safe life safety important anything else,thank iselco always safe life safety important anything else,Positive,0,0.8402
01-Nov-18,thank much iselco,"['Thank', 'you', 'very', 'much', 'ISELCO']","['thank', 'you', 'very', 'much', 'iselco']",thank you very much iselco,thank much iselco,thank much iselco,thank much iselco,Positive,0,0.3612
01-Nov-18,hope next time checklist priority suggest godbless,"['I', 'hope', 'next', 'time', 'you', 'have', 'a', 'checklist', 'of', 'your', 'priorities', '.', 'Just', 'suggesting', '.', 'Godbless']","['i', 'hope', 'next', 'time', 'you', 'have', 'a', 'checklist', 'of', 'your', 'priorities', '.', 'just', 'suggesting', '.', 'godbless']",i hope next time you have a checklist of your priorities  just suggesting  godbless,hope next time checklist priorities suggesting godbless,hope next time checklist priority suggest godbless,hope next time checklist priority suggest godbless,Neutral,2,0.4404
01-Nov-18,iselco prioritizes rich come repair,"['Iselco', 'prioritizes', 'the', 'rich', 'when', 'it', 'comes', 'to', 'repairs']","['iselco', 'prioritizes', 'the', 'rich', 'when', 'it', 'comes', 'to', 'repairs']",iselco prioritizes the rich when it comes to repairs,iselco prioritizes rich comes repairs,iselco prioritizes rich come repair,iselco prioritizes rich come repair,Negative,1,0.5574
01-Nov-18,thank job well do,"['Thank', 'you', 'for', 'job', 'well', 'done', '.']","['thank', 'you', 'for', 'job', 'well', 'done', '.']",thank you for job well done ,thank job well done,thank job well do,thank job well do,Positive,0,0.5574
01-Nov-18,thank electricity restore thank much iselco management,"['thank', 'you', 'and', 'our', 'electricity', 'has', 'been', 'restored', '.', 'Thank', 'you', 'very', 'much', 'ISELCO', 'management', '.']","['thank', 'you', 'and', 'our', 'electricity', 'has', 'been', 'restored', '.', 'thank', 'you', 'very', 'much', 'iselco', 'management', '.']",thank you and our electricity has been restored  thank you very much iselco management ,thank electricity restored thank much iselco management,thank electricity restore thank much iselco management,thank electricity restore thank much iselco management,Positive,0,0.7351
04-Nov-18,salute lineman warrior keep safe,"['Salute', 'to', 'all', 'lineman', 'warriors', '.', 'keep', 'safe', '.']","['salute', 'to', 'all', 'lineman', 'warriors', '.', 'keep', 'safe', '.']",salute to all lineman warriors  keep safe ,salute lineman warriors keep safe,salute lineman warrior keep safe,salute lineman warrior keep safe,Positive,0,0.4404
04-Nov-18,careful know everything u family good time,"['Be', 'careful', '.', 'I', 'know', 'you', 'are', 'doing', 'everything', 'you', 'can', 'so', 'that', 'all', 'of', 'us', 'and', 'your', 'families', 'can', 'have', 'a', 'good', 'time', '.']","['be', 'careful', '.', 'i', 'know', 'you', 'are', 'doing', 'everything', 'you', 'can', 'so', 'that', 'all', 'of', 'us', 'and', 'your', 'families', 'can', 'have', 'a', 'good', 'time', '.']",be careful  i know you are doing everything you can so that all of us and your families can have a good time ,careful know everything us families good time,careful know everything u family good time,careful know everything u family good time,Positive,0,0.5423
04-Nov-18,keep safe iselco brave men thank priceless effort restore electricity salute,"['Keep', 'safe', 'ISELCO', 'brave', 'men', '!', 'Thank', 'you', 'for', 'your', 'priceless', 'efforts', 'to', 'restore', 'the', 'electricity', '.', 'Salute', '!']","['keep', 'safe', 'iselco', 'brave', 'men', '!', 'thank', 'you', 'for', 'your', 'priceless', 'efforts', 'to', 'restore', 'the', 'electricity', '.', 'salute', '!']",keep safe iselco brave men  thank you for your priceless efforts to restore the electricity  salute ,keep safe iselco brave men thank priceless efforts restore electricity salute,keep safe iselco brave men thank priceless effort restore electricity salute,keep safe iselco brave men thank priceless effort restore electricity salute,Positive,0,0.875
04-Nov-18,electricity close aurora branch iselco yet not fix,"['there', 'is', 'no', 'electricity', ',', 'we', 'are', 'close', 'to', 'the', 'aurora', 'branch', 'of', 'Iselco', 'yet', 'you', 'can', 'not', 'fix', 'it']","['there', 'is', 'no', 'electricity', ',', 'we', 'are', 'close', 'to', 'the', 'aurora', 'branch', 'of', 'iselco', 'yet', 'you', 'can', 'not', 'fix', 'it']",there is no electricity  we are close to the aurora branch of iselco yet you can not fix it,electricity close aurora branch iselco yet not fix,electricity close aurora branch iselco yet not fix,electricity close aurora branch iselco yet not fix,Negative,1,0
05-Dec-19,thank much help iriga city facilitate return electricity god bless,"['Thank', 'you', 'so', 'much', '.', 'For', 'helping', 'here', 'in', 'Iriga', 'city', 'to', 'facilitate', 'the', 'return', 'of', 'electricity', '.', 'God', 'bless', '.']","['thank', 'you', 'so', 'much', '.', 'for', 'helping', 'here', 'in', 'iriga', 'city', 'to', 'facilitate', 'the', 'return', 'of', 'electricity', '.', 'god', 'bless', '.']",thank you so much  for helping here in iriga city to facilitate the return of electricity  god bless ,thank much helping iriga city facilitate return electricity god bless,thank much help iriga city facilitate return electricity god bless,thank much help iriga city facilitate return electricity god bless,Positive,0,0.8442
05-Dec-19,careful lineman,"['Be', 'careful', 'Linemans']","['be', 'careful', 'linemans']",be careful linemans,careful linemans,careful lineman,careful lineman,Positive,0,0.1531
05-Dec-19,pray safety protection line warrior light godbless,"['Will', 'pray', 'for', 'your', 'safety', 'and', 'protection', 'line', 'warriors', 'of', 'light', '.', 'Godbless', '!']","['will', 'pray', 'for', 'your', 'safety', 'and', 'protection', 'line', 'warriors', 'of', 'light', '.', 'godbless', '!']",will pray for your safety and protection line warriors of light  godbless ,pray safety protection line warriors light godbless,pray safety protection line warrior light godbless,pray safety protection line warrior light godbless,Positive,0,0.6249
04-Jan-20,bill become double normal something not right,"['My', 'bill', 'became', 'double', 'than', 'the', 'normal', ',', 'something', 'is', 'not', 'right']","['my', 'bill', 'became', 'double', 'than', 'the', 'normal', ',', 'something', 'is', 'not', 'right']",my bill became double than the normal  something is not right,bill became double normal something not right,bill become double normal something not right,bill become double normal something not right,Negative,1,0
22-Feb-20,annoy get good billing service low quality,"['It', 'is', 'annoying', 'how', 'you', 'get', 'so', 'good', 'at', 'billing', ',', 'but', 'your', 'service', 'is', 'low', 'quality']","['it', 'is', 'annoying', 'how', 'you', 'get', 'so', 'good', 'at', 'billing', ',', 'but', 'your', 'service', 'is', 'low', 'quality']",it is annoying how you get so good at billing  but your service is low quality,annoying get good billing service low quality,annoy get good billing service low quality,annoy get good billing service low quality,Negative,1,-0.2732
18-Mar-20,thanks information god bless,"['Thanks', 'for', 'the', 'information', 'God', 'bless', '!']","['thanks', 'for', 'the', 'information', 'god', 'bless', '!']",thanks for the information god bless ,thanks information god bless,thanks information god bless,thanks information god bless,Positive,0,0.7783
27-Mar-20,brownout almost everyday,"['Brownout', 'almost', 'everyday']","['brownout', 'almost', 'everyday']",brownout almost everyday,brownout almost everyday,brownout almost everyday,brownout almost everyday,Negative,1,0
15-Apr-20,maybe come solution constant brownout damage appliance,"['Maybe', 'you', 'can', 'come', 'up', 'with', 'a', 'solution', 'to', 'the', 'constant', 'brownout', ',', 'it', 'damages', 'appliances']","['maybe', 'you', 'can', 'come', 'up', 'with', 'a', 'solution', 'to', 'the', 'constant', 'brownout', ',', 'it', 'damages', 'appliances']",maybe you can come up with a solution to the constant brownout  it damages appliances,maybe come solution constant brownout damages appliances,maybe come solution constant brownout damage appliance,maybe come solution constant brownout damage appliance,Negative,1,-0.2263
15-Apr-20,shock billing notice,"['Shocking', 'billing', 'notice']","['shocking', 'billing', 'notice']",shocking billing notice,shocking billing notice,shock billing notice,shock billing notice,Negative,1,-0.3818
19-Apr-20,electricity bill high service ugly,"['Your', 'electricity', 'bill', 'is', 'so', 'high', ',', 'your', 'service', 'is', 'ugly']","['your', 'electricity', 'bill', 'is', 'so', 'high', ',', 'your', 'service', 'is', 'ugly']",your electricity bill is so high  your service is ugly,electricity bill high service ugly,electricity bill high service ugly,electricity bill high service ugly,Negative,1,-0.5106
19-Apr-20,not need help need good service,"['We', 'do', 'not', 'need', 'your', 'help', '.', 'We', 'need', 'good', 'service', '.']","['we', 'do', 'not', 'need', 'your', 'help', '.', 'we', 'need', 'good', 'service', '.']",we do not need your help  we need good service ,not need help need good service,not need help need good service,not need help need good service,Negative,1,0.1635
19-Apr-20,please explain make appliance like christmas light every night,"['Please', 'explain', 'why', 'you', 'only', 'make', 'our', 'appliances', 'like', 'Christmas', 'lights', 'every', 'night', '?']","['please', 'explain', 'why', 'you', 'only', 'make', 'our', 'appliances', 'like', 'christmas', 'lights', 'every', 'night', '?']",please explain why you only make our appliances like christmas lights every night ,please explain make appliances like christmas lights every night,please explain make appliance like christmas light every night,please explain make appliance like christmas light every night,Neutral,2,0.5859
19-Apr-20,advisory also curfew electricity supply,"['There', 'is', 'no', 'advisory', ',', 'so', 'there', 'is', 'also', 'a', 'curfew', 'on', 'electricity', 'supply']","['there', 'is', 'no', 'advisory', ',', 'so', 'there', 'is', 'also', 'a', 'curfew', 'on', 'electricity', 'supply']",there is no advisory  so there is also a curfew on electricity supply,advisory also curfew electricity supply,advisory also curfew electricity supply,advisory also curfew electricity supply,Negative,1,0
19-Apr-20,keep safe always god bless,"['Keep', 'safe', 'always', '.', 'God', 'bless']","['keep', 'safe', 'always', '.', 'god', 'bless']",keep safe always  god bless,keep safe always god bless,keep safe always god bless,keep safe always god bless,Positive,0,0.7783
19-Apr-20,hope consideration,"['I', 'hope', 'you', 'have', 'consideration']","['i', 'hope', 'you', 'have', 'consideration']",i hope you have consideration,hope consideration,hope consideration,hope consideration,Neutral,2,0.4404
19-Apr-20,maybe someone collect payment home hard go office,"['Maybe', 'someone', 'can', 'collect', 'payment', 'at', 'home', ',', 'it', 'is', 'hard', 'to', 'go', 'to', 'the', 'office']","['maybe', 'someone', 'can', 'collect', 'payment', 'at', 'home', ',', 'it', 'is', 'hard', 'to', 'go', 'to', 'the', 'office']",maybe someone can collect payment at home  it is hard to go to the office,maybe someone collect payment home hard go office,maybe someone collect payment home hard go office,maybe someone collect payment home hard go office,Neutral,2,-0.1027
19-Apr-20,appreciate regular update service interruption,"['I', 'appreciate', 'the', 'regular', 'updates', 'on', 'service', 'interruptions', '.']","['i', 'appreciate', 'the', 'regular', 'updates', 'on', 'service', 'interruptions', '.']",i appreciate the regular updates on service interruptions ,appreciate regular updates service interruptions,appreciate regular update service interruption,appreciate regular update service interruption,Positive,0,0.0516
19-Apr-20,service provide reliable,"['The', 'service', 'provided', 'is', 'reliable']","['the', 'service', 'provided', 'is', 'reliable']",the service provided is reliable,service provided reliable,service provide reliable,service provide reliable,Positive,0,0
19-Apr-20,service quality decrease significantly,"['The', 'service', 'quality', 'has', 'decreased', 'significantly']","['the', 'service', 'quality', 'has', 'decreased', 'significantly']",the service quality has decreased significantly,service quality decreased significantly,service quality decrease significantly,service quality decrease significantly,Negative,1,0
19-Apr-20,frustrate frequent unannounced power outage,"['I', 'am', 'frustrated', 'with', 'the', 'frequent', 'and', 'unannounced', 'power', 'outages', '.']","['i', 'am', 'frustrated', 'with', 'the', 'frequent', 'and', 'unannounced', 'power', 'outages', '.']",i am frustrated with the frequent and unannounced power outages ,frustrated frequent unannounced power outages,frustrate frequent unannounced power outage,frustrate frequent unannounced power outage,Negative,1,-0.4588
19-Apr-20,hotline often busy unresponsive need assistance,"['The', 'hotline', 'is', 'often', 'busy', 'or', 'unresponsive', 'when', 'I', 'need', 'assistance', '.']","['the', 'hotline', 'is', 'often', 'busy', 'or', 'unresponsive', 'when', 'i', 'need', 'assistance', '.']",the hotline is often busy or unresponsive when i need assistance ,hotline often busy unresponsive need assistance,hotline often busy unresponsive need assistance,hotline often busy unresponsive need assistance,Negative,1,0
19-Apr-20,recent bill unexpectedly high receive explanation,"['My', 'recent', 'bill', 'was', 'unexpectedly', 'high', ',', 'and', 'I', 'received', 'no', 'explanation', '.']","['my', 'recent', 'bill', 'was', 'unexpectedly', 'high', ',', 'and', 'i', 'received', 'no', 'explanation', '.']",my recent bill was unexpectedly high  and i received no explanation ,recent bill unexpectedly high received explanation,recent bill unexpectedly high receive explanation,recent bill unexpectedly high receive explanation,Negative,1,0
19-Apr-20,service interruption inconvenient understand issue arise,"['The', 'service', 'interruptions', 'are', 'inconvenient', ',', 'but', 'I', 'understand', 'that', 'issues', 'arise', '.']","['the', 'service', 'interruptions', 'are', 'inconvenient', ',', 'but', 'i', 'understand', 'that', 'issues', 'arise', '.']",the service interruptions are inconvenient  but i understand that issues arise ,service interruptions inconvenient understand issues arise,service interruption inconvenient understand issue arise,service interruption inconvenient understand issue arise,Neutral,2,-0.5994
19-Apr-20,hope see well communication iselco regard outage,"['I', 'hope', 'to', 'see', 'better', 'communication', 'from', 'ISELCO', 'regarding', 'outages', '.']","['i', 'hope', 'to', 'see', 'better', 'communication', 'from', 'iselco', 'regarding', 'outages', '.']",i hope to see better communication from iselco regarding outages ,hope see better communication iselco regarding outages,hope see well communication iselco regard outage,hope see well communication iselco regard outage,Neutral,2,0.6124
19-Apr-20,service acceptable would appreciate transparency,"['The', 'service', 'is', 'acceptable', ',', 'but', 'I', 'would', 'appreciate', 'more', 'transparency', '.']","['the', 'service', 'is', 'acceptable', ',', 'but', 'i', 'would', 'appreciate', 'more', 'transparency', '.']",the service is acceptable  but i would appreciate more transparency ,service acceptable would appreciate transparency,service acceptable would appreciate transparency,service acceptable would appreciate transparency,Neutral,2,0.6124
19-Apr-20,would like receive information schedule outage expect duration,"['I', 'would', 'like', 'to', 'receive', 'more', 'information', 'about', 'scheduled', 'outages', 'and', 'their', 'expected', 'duration', '.']","['i', 'would', 'like', 'to', 'receive', 'more', 'information', 'about', 'scheduled', 'outages', 'and', 'their', 'expected', 'duration', '.']",i would like to receive more information about scheduled outages and their expected duration ,would like receive information scheduled outages expected duration,would like receive information schedule outage expect duration,would like receive information schedule outage expect duration,Neutral,2,0.3612
19-Apr-20,service adequate hope consistency reliability future,"['The', 'service', 'is', 'adequate', ',', 'but', 'I', 'hope', 'for', 'more', 'consistency', 'and', 'reliability', 'in', 'the', 'future', '.']","['the', 'service', 'is', 'adequate', ',', 'but', 'i', 'hope', 'for', 'more', 'consistency', 'and', 'reliability', 'in', 'the', 'future', '.']",the service is adequate  but i hope for more consistency and reliability in the future ,service adequate hope consistency reliability future,service adequate hope consistency reliability future,service adequate hope consistency reliability future,Positive,0,0.5859
19-Apr-20,notice improvement,"['I', 'have', 'noticed', 'some', 'improvements']","['i', 'have', 'noticed', 'some', 'improvements']",i have noticed some improvements,noticed improvements,notice improvement,notice improvement,Positive,0,0.4588
