Date,Feedback,tokens,Normalized_Feedback,Punctuation_Removal,Remove_stop_words,Lematization,Clean_data,Label,Numeric_Label,Compound_Score
25-Jul-22,always fix brownout,"['It', 'is', 'always', 'fixed', 'then', 'brownout', 'again', '.']","['it', 'is', 'always', 'fixed', 'then', 'brownout', 'again', '.']",it is always fixed then brownout again ,always fixed brownout,always fix brownout,always fix brownout,Negative,1,0
25-Jul-22,please improve service,"['Please', 'improve', 'the', 'service']","['please', 'improve', 'the', 'service']",please improve the service,please improve service,please improve service,please improve service,Neutral,2,0.6369
25-Jul-22,iselco brownout without warn,"['Iselco', 'brownout', 'again', 'without', 'warning', '!']","['iselco', 'brownout', 'again', 'without', 'warning', '!']",iselco brownout again without warning ,iselco brownout without warning,iselco brownout without warn,iselco brownout without warn,Negative,1,0.0762
25-Jul-22,replace damage item fire,"['YOU', 'SHOULD', 'REPLACE', 'THE', 'DAMAGED', 'ITEMS', 'BECAUSE', 'OF', 'THAT', 'FIRE', '.']","['you', 'should', 'replace', 'the', 'damaged', 'items', 'because', 'of', 'that', 'fire', '.']",you should replace the damaged items because of that fire ,replace damaged items fire,replace damage item fire,replace damage item fire,Negative,1,-0.6808
25-Jul-22,bill big,"['The', 'bill', 'is', 'so', 'big']","['the', 'bill', 'is', 'so', 'big']",the bill is so big,bill big,bill big,bill big,Negative,1,0
25-Jul-22,hope schedule brownout,"['I', 'hope', 'you', 'schedule', 'brownout', '.']","['i', 'hope', 'you', 'schedule', 'brownout', '.']",i hope you schedule brownout ,hope schedule brownout,hope schedule brownout,hope schedule brownout,Neutral,2,0.4404
25-Jul-22,fix update,"['Fix', 'your', 'update']","['fix', 'your', 'update']",fix your update,fix update,fix update,fix update,Neutral,2,0
25-Jul-22,really like surprise service ugly,"['you', 'really', 'like', 'surprises', '!', 'your', 'service', 'is', 'so', 'ugly', '!']","['you', 'really', 'like', 'surprises', '!', 'your', 'service', 'is', 'so', 'ugly', '!']",you really like surprises  your service is so ugly ,really like surprises service ugly,really like surprise service ugly,really like surprise service ugly,Negative,1,0.2195
25-Jul-22,power restore soon damage many appliance,"['Power', 'will', 'restore', 'as', 'soon', 'as', 'you', 'have', 'damaged', 'many', 'appliances']","['power', 'will', 'restore', 'as', 'soon', 'as', 'you', 'have', 'damaged', 'many', 'appliances']",power will restore as soon as you have damaged many appliances,power restore soon damaged many appliances,power restore soon damage many appliance,power restore soon damage many appliance,Negative,1,-0.25
25-Jul-22,ruin appliance schedule brownout properly,"['You', 'are', 'ruining', 'appliances', '.', 'Just', 'schedule', 'the', 'brownout', 'properly']","['you', 'are', 'ruining', 'appliances', '.', 'just', 'schedule', 'the', 'brownout', 'properly']",you are ruining appliances  just schedule the brownout properly,ruining appliances schedule brownout properly,ruin appliance schedule brownout properly,ruin appliance schedule brownout properly,Negative,1,-0.5859
25-Jul-22,smell like high bill brownout,"['It', 'smell', 'like', 'a', 'high', 'bill', 'again', ',', 'it', 'is', 'brownout']","['it', 'smell', 'like', 'a', 'high', 'bill', 'again', ',', 'it', 'is', 'brownout']",it smell like a high bill again  it is brownout,smell like high bill brownout,smell like high bill brownout,smell like high bill brownout,Negative,1,0.3612
25-Jul-22,increase consumer fee turn electricity,"['You', 'just', 'increase', 'your', 'consumers', 'fees', 'and', 'then', 'turn', 'off', 'the', 'electricity']","['you', 'just', 'increase', 'your', 'consumers', 'fees', 'and', 'then', 'turn', 'off', 'the', 'electricity']",you just increase your consumers fees and then turn off the electricity,increase consumers fees turn electricity,increase consumer fee turn electricity,increase consumer fee turn electricity,Negative,1,0.3182
25-Jul-22,destroy consumer appliance not provide good service,"['you', 'are', 'destroying', 'your', 'consumers', 'appliances', '.', 'You', 'are', 'not', 'providing', 'good', 'services', '.']","['you', 'are', 'destroying', 'your', 'consumers', 'appliances', '.', 'you', 'are', 'not', 'providing', 'good', 'services', '.']",you are destroying your consumers appliances  you are not providing good services ,destroying consumers appliances not providing good services,destroy consumer appliance not provide good service,destroy consumer appliance not provide good service,Negative,1,-0.7101
25-Jul-22,brownout corrupt people,"['brownout', 'again', ',', 'you', 'are', 'just', 'the', 'same', 'corrupt', 'people', '.']","['brownout', 'again', ',', 'you', 'are', 'just', 'the', 'same', 'corrupt', 'people', '.']",brownout again  you are just the same corrupt people ,brownout corrupt people,brownout corrupt people,brownout corrupt people,Negative,1,0
30-Jul-22,barangay brownout not include list,"['our', 'barangay', 'is', 'brownout', 'but', 'you', 'did', 'not', 'include', 'it', 'in', 'your', 'list']","['our', 'barangay', 'is', 'brownout', 'but', 'you', 'did', 'not', 'include', 'it', 'in', 'your', 'list']",our barangay is brownout but you did not include it in your list,barangay brownout not include list,barangay brownout not include list,barangay brownout not include list,Negative,1,0
30-Jul-22,always late update,"['Always', 'late', 'update']","['always', 'late', 'update']",always late update,always late update,always late update,always late update,Negative,1,0
30-Jul-22,iselco not improve,"['ISELCO', 'has', 'not', 'improved']","['iselco', 'has', 'not', 'improved']",iselco has not improved,iselco not improved,iselco not improve,iselco not improve,Negative,1,-0.3412
30-Jul-22,brownout anytime without notice,"['brownout', 'anytime', 'without', 'notice']","['brownout', 'anytime', 'without', 'notice']",brownout anytime without notice,brownout anytime without notice,brownout anytime without notice,brownout anytime without notice,Negative,1,0
30-Jul-22,sudden brownout without advisory,"['Sudden', 'brownouts', 'without', 'advisory']","['sudden', 'brownouts', 'without', 'advisory']",sudden brownouts without advisory,sudden brownouts without advisory,sudden brownout without advisory,sudden brownout without advisory,Negative,1,0
30-Jul-22,respect iselco thanks notice,"['I', 'will', 'respect', 'you', 'Iselco', ',', 'thanks', 'for', 'the', 'notice']","['i', 'will', 'respect', 'you', 'iselco', ',', 'thanks', 'for', 'the', 'notice']",i will respect you iselco  thanks for the notice,respect iselco thanks notice,respect iselco thanks notice,respect iselco thanks notice,Positive,0,0.7184
30-Jul-22,iselco provide best service customer,"['The', 'ISELCO', 'provides', 'the', 'best', 'services', 'for', 'their', 'customers']","['the', 'iselco', 'provides', 'the', 'best', 'services', 'for', 'their', 'customers']",the iselco provides the best services for their customers,iselco provides best services customers,iselco provide best service customer,iselco provide best service customer,Positive,0,0.6369
30-Jul-22,annoy sometimes power shortage,"['It', 'is', 'annoying', 'sometimes', 'because', 'of', 'power', 'shortage']","['it', 'is', 'annoying', 'sometimes', 'because', 'of', 'power', 'shortage']",it is annoying sometimes because of power shortage,annoying sometimes power shortage,annoy sometimes power shortage,annoy sometimes power shortage,Negative,1,-0.5994
13-Aug-22,thank iselco fast repair,"['Thank', 'you', 'iselco', 'for', 'the', 'fast', 'repair']","['thank', 'you', 'iselco', 'for', 'the', 'fast', 'repair']",thank you iselco for the fast repair,thank iselco fast repair,thank iselco fast repair,thank iselco fast repair,Positive,0,0.3612
13-Aug-22,okay increase bill service good,"['It', 'is', 'okay', 'to', 'increase', 'the', 'bill', 'if', 'the', 'service', 'is', 'good', '.']","['it', 'is', 'okay', 'to', 'increase', 'the', 'bill', 'if', 'the', 'service', 'is', 'good', '.']",it is okay to increase the bill if the service is good ,okay increase bill service good,okay increase bill service good,okay increase bill service good,Positive,0,0.7269
13-Aug-22,not funny anymore iselco,"['You', 'are', 'not', 'funny', 'anymore', 'Iselco']","['you', 'are', 'not', 'funny', 'anymore', 'iselco']",you are not funny anymore iselco,not funny anymore iselco,not funny anymore iselco,not funny anymore iselco,Negative,1,-0.3412
13-Aug-22,thank good service iselco,"['Thank', 'you', 'for', 'the', 'good', 'service', 'Iselco']","['thank', 'you', 'for', 'the', 'good', 'service', 'iselco']",thank you for the good service iselco,thank good service iselco,thank good service iselco,thank good service iselco,Positive,0,0.6597
13-Aug-22,update late time still wrong,"['The', 'update', 'was', 'late', 'and', 'the', 'time', 'was', 'still', 'wrong']","['the', 'update', 'was', 'late', 'and', 'the', 'time', 'was', 'still', 'wrong']",the update was late and the time was still wrong,update late time still wrong,update late time still wrong,update late time still wrong,Negative,1,-0.4767
13-Aug-22,iselco add stress,"['Iselco', 'only', 'adds', 'stress']","['iselco', 'only', 'adds', 'stress']",iselco only adds stress,iselco adds stress,iselco add stress,iselco add stress,Negative,1,-0.4215
13-Aug-22,iselco service change service messy,"['When', 'will', 'Iselco', 'service', 'change', '?', 'Your', 'service', 'is', 'messy']","['when', 'will', 'iselco', 'service', 'change', '?', 'your', 'service', 'is', 'messy']",when will iselco service change  your service is messy,iselco service change service messy,iselco service change service messy,iselco service change service messy,Negative,1,-0.3612
13-Aug-22,careful linemen even iselco service not good,"['Be', 'careful', 'with', 'the', 'linemen', 'even', 'if', 'the', 'Iselco', 'service', 'is', 'not', 'good']","['be', 'careful', 'with', 'the', 'linemen', 'even', 'if', 'the', 'iselco', 'service', 'is', 'not', 'good']",be careful with the linemen even if the iselco service is not good,careful linemen even iselco service not good,careful linemen even iselco service not good,careful linemen even iselco service not good,Neutral,2,-0.2037
23-Aug-22,beware iselco,"['Beware', 'Iselco', '.']","['beware', 'iselco', '.']",beware iselco ,beware iselco,beware iselco,beware iselco,Neutral,2,0
29-Aug-22,hot weather beautiful brown,"['It', 'is', 'hot', ',', 'the', 'weather', 'is', 'beautiful', ',', 'brown', 'out']","['it', 'is', 'hot', ',', 'the', 'weather', 'is', 'beautiful', ',', 'brown', 'out']",it is hot  the weather is beautiful  brown out,hot weather beautiful brown,hot weather beautiful brown,hot weather beautiful brownout,Neutral,2,0.5994
01-Sep-22,poor service high electricity charge,"['Very', 'poor', 'service', 'and', 'high', 'electricity', 'charge']","['very', 'poor', 'service', 'and', 'high', 'electricity', 'charge']",very poor service and high electricity charge,poor service high electricity charge,poor service high electricity charge,poor service high electricity charge,Negative,1,-0.4767
01-Sep-22,not zero review deserve,"['Why', 'you', 'do', 'not', 'have', 'zero', 'for', 'review', '?', 'You', 'deserve', 'it']","['why', 'you', 'do', 'not', 'have', 'zero', 'for', 'review', '?', 'you', 'deserve', 'it']",why you do not have zero for review  you deserve it,not zero review deserve,not zero review deserve,not zero review deserve,Negative,1,0
16-Sep-22,give notice ahead time disturbance people work,"['Give', 'a', 'notice', 'ahead', 'of', 'time', ',', 'you', 'are', 'a', 'disturbance', 'for', 'people', 'with', 'work']","['give', 'a', 'notice', 'ahead', 'of', 'time', ',', 'you', 'are', 'a', 'disturbance', 'for', 'people', 'with', 'work']",give a notice ahead of time  you are a disturbance for people with work,give notice ahead time disturbance people work,give notice ahead time disturbance people work,give notice ahead time disturbance people work,Negative,1,-0.3818
16-Sep-22,slight rain electricity,"['Just', 'a', 'slight', 'rain', 'and', 'there', 'is', 'no', 'electricity']","['just', 'a', 'slight', 'rain', 'and', 'there', 'is', 'no', 'electricity']",just a slight rain and there is no electricity,slight rain electricity,slight rain electricity,slight rain electricity,Negative,1,0
16-Sep-22,work hard even though already night still fix power line,"['You', 'work', 'hard', 'even', 'though', 'it', 'is', 'already', 'night', 'and', 'you', 'are', 'still', 'fixing', 'power', 'lines']","['you', 'work', 'hard', 'even', 'though', 'it', 'is', 'already', 'night', 'and', 'you', 'are', 'still', 'fixing', 'power', 'lines']",you work hard even though it is already night and you are still fixing power lines,work hard even though already night still fixing power lines,work hard even though already night still fix power line,work hard even though already night still fix power line,Positive,0,-0.1027
16-Sep-22,hope update include also time electricity back,"['I', 'hope', 'in', 'your', 'updates', ',', 'include', 'also', 'the', 'time', 'when', 'the', 'electricity', 'will', 'be', 'back']","['i', 'hope', 'in', 'your', 'updates', ',', 'include', 'also', 'the', 'time', 'when', 'the', 'electricity', 'will', 'be', 'back']",i hope in your updates  include also the time when the electricity will be back,hope updates include also time electricity back,hope update include also time electricity back,hope update include also time electricity back,Neutral,2,0.4404
17-Sep-22,service feel like every month christmas light appliance,"['Service', 'feels', 'like', 'every', 'month', 'Christmas', ',', 'lights', 'and', 'appliances', 'are', 'on', 'and', 'off', '!']","['service', 'feels', 'like', 'every', 'month', 'christmas', ',', 'lights', 'and', 'appliances', 'are', 'on', 'and', 'off', '!']",service feels like every month christmas  lights and appliances are on and off ,service feels like every month christmas lights appliances,service feel like every month christmas light appliance,service feel like every month christmas light appliance,Negative,1,0.3612
18-Sep-22,sue,"['You', 'should', 'be', 'sued']","['you', 'should', 'be', 'sued']",you should be sued,sued,sue,sue,Negative,1,0
21-Sep-22,frequent brownout day,"['Frequent', 'brownout', 'in', 'a', 'day']","['frequent', 'brownout', 'in', 'a', 'day']",frequent brownout in a day,frequent brownout day,frequent brownout day,frequent brownout day,Negative,1,0
21-Sep-22,brownout destructive,"['the', 'brownout', 'was', 'very', 'destructive']","['the', 'brownout', 'was', 'very', 'destructive']",the brownout was very destructive,brownout destructive,brownout destructive,brownout destructive,Negative,1,-0.6124
21-Oct-22,iselco one still good bill drop iselco two still go,"['Iselco', 'one', 'is', 'still', 'good', ',', 'their', 'bill', 'has', 'dropped', 'but', 'Iselco', 'two', 'is', 'still', 'going', 'up', 'and', 'up']","['iselco', 'one', 'is', 'still', 'good', ',', 'their', 'bill', 'has', 'dropped', 'but', 'iselco', 'two', 'is', 'still', 'going', 'up', 'and', 'up']",iselco one is still good  their bill has dropped but iselco two is still going up and up,iselco one still good bill dropped iselco two still going,iselco one still good bill drop iselco two still go,iselco one still good bill drop iselco two still go,Negative,1,0.2023
21-Oct-22,service consistently poor experience brownout almost daily,"['The', 'service', 'is', 'consistently', 'poor', ';', 'we', 'experience', 'brownout', 'almost', 'daily', '.']","['the', 'service', 'is', 'consistently', 'poor', ';', 'we', 'experience', 'brownout', 'almost', 'daily', '.']",the service is consistently poor  we experience brownout almost daily ,service consistently poor experience brownout almost daily,service consistently poor experience brownout almost daily,service consistently poor experience brownout almost daily,Negative,1,-0.4767
22-Oct-22,always brownout electricity charge high,"['Always', 'brownout', 'and', 'electricity', 'charge', 'is', 'too', 'high']","['always', 'brownout', 'and', 'electricity', 'charge', 'is', 'too', 'high']",always brownout and electricity charge is too high,always brownout electricity charge high,always brownout electricity charge high,always brownout electricity charge high,Negative,1,0
22-Oct-22,power always option,"['The', 'power', 'is', 'always', 'off', ',', 'if', 'there', 'is', 'only', 'other', 'option']","['the', 'power', 'is', 'always', 'off', ',', 'if', 'there', 'is', 'only', 'other', 'option']",the power is always off  if there is only other option,power always option,power always option,power always option,Negative,1,0
26-Oct-22,hotline always available easy reach,"['The', 'hotline', 'is', 'always', 'available', 'and', 'easy', 'to', 'reach', '.']","['the', 'hotline', 'is', 'always', 'available', 'and', 'easy', 'to', 'reach', '.']",the hotline is always available and easy to reach ,hotline always available easy reach,hotline always available easy reach,hotline always available easy reach,Positive,0,0.4588
01-Nov-22,thank iselco high power rate poor service,"['Thank', 'you', 'Iselco', 'for', 'the', 'high', 'power', 'rates', 'and', 'for', 'your', 'poor', 'service', '.']","['thank', 'you', 'iselco', 'for', 'the', 'high', 'power', 'rates', 'and', 'for', 'your', 'poor', 'service', '.']",thank you iselco for the high power rates and for your poor service ,thank iselco high power rates poor service,thank iselco high power rate poor service,thank iselco high power rate poor service,Negative,1,-0.1531
01-Nov-22,staff ignore not respond query costumer,"['The', 'staffs', 'are', 'ignoring', 'and', 'not', 'responding', 'on', 'the', 'queries', 'of', 'the', 'costumers']","['the', 'staffs', 'are', 'ignoring', 'and', 'not', 'responding', 'on', 'the', 'queries', 'of', 'the', 'costumers']",the staffs are ignoring and not responding on the queries of the costumers,staffs ignoring not responding queries costumers,staff ignore not respond query costumer,staff ignore not respond query costumer,Negative,1,-0.3612
01-Nov-22,always ignore query costumer,"['You', 'are', 'always', 'ignoring', 'the', 'queries', 'of', 'your', 'costumers']","['you', 'are', 'always', 'ignoring', 'the', 'queries', 'of', 'your', 'costumers']",you are always ignoring the queries of your costumers,always ignoring queries costumers,always ignore query costumer,always ignore query costumer,Negative,1,-0.3612
06-Nov-22,frequent power interruption high power rate,"['frequent', 'power', 'interruptions', 'and', 'high', 'power', 'rates']","['frequent', 'power', 'interruptions', 'and', 'high', 'power', 'rates']",frequent power interruptions and high power rates,frequent power interruptions high power rates,frequent power interruption high power rate,frequent power interruption high power rate,Negative,1,-0.3612
18-Nov-22,electricity charge high yet service low,"['The', 'electricity', 'charge', 'is', 'too', 'high', 'yet', 'your', 'service', 'is', 'very', 'low']","['the', 'electricity', 'charge', 'is', 'too', 'high', 'yet', 'your', 'service', 'is', 'very', 'low']",the electricity charge is too high yet your service is very low,electricity charge high yet service low,electricity charge high yet service low,electricity charge high yet service low,Negative,1,-0.2732
22-Nov-22,unscheduled brownout,"['Unscheduled', 'brownout']","['unscheduled', 'brownout']",unscheduled brownout,unscheduled brownout,unscheduled brownout,unscheduled brownout,Negative,1,0
22-Nov-22,brownout announcement iselco terrify,"['you', 'had', 'a', 'brownout', 'before', 'the', 'announcement', ',', 'ISELCO', 'is', 'terrifying']","['you', 'had', 'a', 'brownout', 'before', 'the', 'announcement', ',', 'iselco', 'is', 'terrifying']",you had a brownout before the announcement  iselco is terrifying,brownout announcement iselco terrifying,brownout announcement iselco terrify,brownout announcement iselco terrify,Negative,1,-0.5106
22-Nov-22,late notice always,"['Late', 'notice', ',', 'always']","['late', 'notice', ',', 'always']",late notice  always,late notice always,late notice always,late notice always,Negative,1,0
22-Nov-22,iselco interrupt u,"['Iselco', 'interrupts', 'us', '!']","['iselco', 'interrupts', 'us', '!']",iselco interrupts us ,iselco interrupts us,iselco interrupt u,iselco interrupt u,Negative,1,-0.34
22-Nov-22,incomplete information,"['incomplete', 'information', '.']","['incomplete', 'information', '.']",incomplete information ,incomplete information,incomplete information,incomplete information,Negative,1,0
22-Nov-22,not even post schedule power interruption,"['You', 'do', 'not', 'even', 'post', 'a', 'schedule', 'before', 'the', 'power', 'interruption', '.']","['you', 'do', 'not', 'even', 'post', 'a', 'schedule', 'before', 'the', 'power', 'interruption', '.']",you do not even post a schedule before the power interruption ,not even post schedule power interruption,not even post schedule power interruption,not even post schedule power interruption,Negative,1,-0.3612
22-Nov-22,give u complete information conduct brownout,"['give', 'us', 'complete', 'information', 'when', 'conducting', 'brownout']","['give', 'us', 'complete', 'information', 'when', 'conducting', 'brownout']",give us complete information when conducting brownout,give us complete information conducting brownout,give u complete information conduct brownout,give us complete information conduct brownout,Neutral,2,0
22-Nov-22,notify u ahead time,"['You', 'should', 'notify', 'us', 'ahead', 'of', 'time']","['you', 'should', 'notify', 'us', 'ahead', 'of', 'time']",you should notify us ahead of time,notify us ahead time,notify u ahead time,notify u ahead time,Neutral,2,0
22-Nov-22,announce right away brownout happens,"['You', 'should', 'announce', 'it', 'right', 'away', 'when', 'brownout', 'happens']","['you', 'should', 'announce', 'it', 'right', 'away', 'when', 'brownout', 'happens']",you should announce it right away when brownout happens,announce right away brownout happens,announce right away brownout happens,announce right away brownout happens,Neutral,2,0
23-Nov-22,update correctly,"['Update', 'correctly', '!']","['update', 'correctly', '!']",update correctly ,update correctly,update correctly,update correctly,Negative,1,0
17-Dec-22,make electricity like christmas light,"['You', 'are', 'making', 'the', 'electricity', 'like', 'a', 'christmas', 'light']","['you', 'are', 'making', 'the', 'electricity', 'like', 'a', 'christmas', 'light']",you are making the electricity like a christmas light,making electricity like christmas light,make electricity like christmas light,make electricity like christmas light,Negative,1,0.3612
17-Dec-22,please fix maintenance not get damage,"['Please', 'fix', 'your', 'maintenance', 'so', 'that', 'we', 'do', 'not', 'get', 'damaged', 'again']","['please', 'fix', 'your', 'maintenance', 'so', 'that', 'we', 'do', 'not', 'get', 'damaged', 'again']",please fix your maintenance so that we do not get damaged again,please fix maintenance not get damaged,please fix maintenance not get damage,please fix maintenance not get damage,Negative,1,0.6031
17-Dec-22,not even update people grievance,"['You', 'do', 'not', 'even', 'have', 'an', 'update', 'on', 'people', 'grievances', '.']","['you', 'do', 'not', 'even', 'have', 'an', 'update', 'on', 'people', 'grievances', '.']",you do not even have an update on people grievances ,not even update people grievances,not even update people grievance,not even update people grievance,Negative,1,-0.4767
17-Dec-22,upgrade time bill high quality low,"['upgrade', 'when', 'there', 'is', 'time', '.', 'Your', 'bill', 'is', 'so', 'high', 'and', 'the', 'quality', 'is', 'low']","['upgrade', 'when', 'there', 'is', 'time', '.', 'your', 'bill', 'is', 'so', 'high', 'and', 'the', 'quality', 'is', 'low']",upgrade when there is time  your bill is so high and the quality is low,upgrade time bill high quality low,upgrade time bill high quality low,upgrade time bill high quality low,Negative,1,-0.2732
17-Dec-22,many damage time upgrade,"['so', 'many', 'damage', ',', 'time', 'to', 'upgrade']","['so', 'many', 'damage', ',', 'time', 'to', 'upgrade']",so many damage  time to upgrade,many damage time upgrade,many damage time upgrade,many damage time upgrade,Negative,1,-0.4939
17-Dec-22,thank consistent service,"['Thank', 'you', 'for', 'consistent', 'service']","['thank', 'you', 'for', 'consistent', 'service']",thank you for consistent service,thank consistent service,thank consistent service,thank consistent service,Positive,0,0.3612
17-Dec-22,good conduct clean,"['It', 'is', 'good', 'to', 'conduct', 'clean', 'up']","['it', 'is', 'good', 'to', 'conduct', 'clean', 'up']",it is good to conduct clean up,good conduct clean,good conduct clean,good conduct clean,Positive,0,0.6808
17-Dec-22,iselco size bill charge still high,"['Iselco', ',', 'the', 'size', 'of', 'the', 'bill', 'you', 'are', 'charging', 'is', 'still', 'the', 'same', ',', 'it', 'is', 'so', 'high']","['iselco', ',', 'the', 'size', 'of', 'the', 'bill', 'you', 'are', 'charging', 'is', 'still', 'the', 'same', ',', 'it', 'is', 'so', 'high']",iselco  the size of the bill you are charging is still the same  it is so high,iselco size bill charging still high,iselco size bill charge still high,iselco size bill charge still high,Negative,1,0
17-Dec-22,please fix power line,"['Please', 'fix', 'the', 'power', 'lines']","['please', 'fix', 'the', 'power', 'lines']",please fix the power lines,please fix power lines,please fix power line,please fix power line,Neutral,2,0.3182
17-Dec-22,really repair night,"['YOU', 'REALLY', 'REPAIR', 'AT', 'NIGHT']","['you', 'really', 'repair', 'at', 'night']",you really repair at night,really repair night,really repair night,really repair night,Neutral,2,0
17-Dec-22,always brownout every night,"['It', 'is', 'always', 'brownout', 'every', 'night']","['it', 'is', 'always', 'brownout', 'every', 'night']",it is always brownout every night,always brownout every night,always brownout every night,always brownout every night,Negative,1,0
