Date,Feedback,tokens,Normalized_Feedback,Punctuation_Removal,Remove_stop_words,Lematization,Clean_data,Label,Numeric_Label,Compound_Score
27-Mar-24,far block,"['So', 'far', ',', 'no', 'block', 'out']","['so', 'far', ',', 'no', 'block', 'out']",so far  no block out,far block,far block,far block,Positive,0,-0.4404
27-Mar-24,service good,"['The', 'service', 'is', 'good']","['the', 'service', 'is', 'good']",the service is good,service good,service good,service good,Positive,0,0.4404
27-Mar-24,would like express appreciation gratitude efficient reliable service provide iselco,"['I', 'would', 'like', 'to', 'express', 'my', 'appreciation', 'and', 'gratitude', 'for', 'the', 'efficient', 'and', 'reliable', 'service', 'provided', 'by', 'ISELCO', '.']","['i', 'would', 'like', 'to', 'express', 'my', 'appreciation', 'and', 'gratitude', 'for', 'the', 'efficient', 'and', 'reliable', 'service', 'provided', 'by', 'iselco', '.']",i would like to express my appreciation and gratitude for the efficient and reliable service provided by iselco ,would like express appreciation gratitude efficient reliable service provided iselco,would like express appreciation gratitude efficient reliable service provide iselco,would like express appreciation gratitude efficient reliable service provide iselco,Positive,0,0.8979
27-Mar-24,iselco consistently notify u power interruption,"['ISELCO', 'has', 'consistently', 'notified', 'us', 'about', 'power', 'interruptions']","['iselco', 'has', 'consistently', 'notified', 'us', 'about', 'power', 'interruptions']",iselco has consistently notified us about power interruptions,iselco consistently notified us power interruptions,iselco consistently notify u power interruption,iselco consistently notify u power interruption,Positive,0,-0.3612
27-Mar-24,good,['Goods'],['goods'],goods,goods,good,good,Positive,0,0.4404
27-Mar-24,verry good,"['Verry', 'good']","['verry', 'good']",verry good,verry good,verry good,verry good,Positive,0,0.4404
27-Mar-24,suggest improve service maybe lessen time power outage,"['I', 'suggest', 'to', 'improve', 'their', 'service', 'more', 'and', 'maybe', 'lessen', 'the', 'times', 'of', 'doing', 'power', 'outage']","['i', 'suggest', 'to', 'improve', 'their', 'service', 'more', 'and', 'maybe', 'lessen', 'the', 'times', 'of', 'doing', 'power', 'outage']",i suggest to improve their service more and maybe lessen the times of doing power outage,suggest improve service maybe lessen times power outage,suggest improve service maybe lessen time power outage,suggest improve service maybe lessen time power outage,Positive,0,0.4404
27-Mar-24,service iselco fair enough,"['The', 'service', 'of', 'ISELCO', 'is', 'fair', 'enough']","['the', 'service', 'of', 'iselco', 'is', 'fair', 'enough']",the service of iselco is fair enough,service iselco fair enough,service iselco fair enough,service iselco fair enough,Positive,0,0.3182
27-Mar-24,hope announce advance people prepared not suddenly cut electricity,"['I', 'hope', 'you', 'announce', 'in', 'advance', 'so', 'that', 'people', 'can', 'be', 'prepared', ',', 'not', 'that', 'you', 'suddenly', 'cut', 'off', 'electricity']","['i', 'hope', 'you', 'announce', 'in', 'advance', 'so', 'that', 'people', 'can', 'be', 'prepared', ',', 'not', 'that', 'you', 'suddenly', 'cut', 'off', 'electricity']",i hope you announce in advance so that people can be prepared  not that you suddenly cut off electricity,hope announce advance people prepared not suddenly cut electricity,hope announce advance people prepared not suddenly cut electricity,hope announce advance people prepared not suddenly cut electricity,Negative,1,0.6822
27-Mar-24,always say unscheduled brownout make name company good,"['You', 'always', 'say', 'unscheduled', 'brownout', ',', 'just', 'make', 'that', 'the', 'name', 'of', 'your', 'company', ',', 'you', 'are', 'good', 'at', 'that']","['you', 'always', 'say', 'unscheduled', 'brownout', ',', 'just', 'make', 'that', 'the', 'name', 'of', 'your', 'company', ',', 'you', 'are', 'good', 'at', 'that']",you always say unscheduled brownout  just make that the name of your company  you are good at that,always say unscheduled brownout make name company good,always say unscheduled brownout make name company good,always say unscheduled brownout make name company good,Negative,1,0.4404
27-Mar-24,announcement late sudden advance people prepare,"['Why', 'is', 'the', 'announcement', 'so', 'late', ',', 'it', 'is', 'sudden', ',', 'it', 'should', 'be', 'in', 'advance', 'so', 'people', 'can', 'prepare']","['why', 'is', 'the', 'announcement', 'so', 'late', ',', 'it', 'is', 'sudden', ',', 'it', 'should', 'be', 'in', 'advance', 'so', 'people', 'can', 'prepare']",why is the announcement so late  it is sudden  it should be in advance so people can prepare,announcement late sudden advance people prepare,announcement late sudden advance people prepare,announcement late sudden advance people prepare,Negative,1,0
27-Mar-24,san isidro isabela brown not include list,"['San', 'Isidro', 'Isabela', 'brown', 'out', ',', 'you', 'did', 'not', 'include', 'it', 'in', 'your', 'list']","['san', 'isidro', 'isabela', 'brown', 'out', ',', 'you', 'did', 'not', 'include', 'it', 'in', 'your', 'list']",san isidro isabela brown out  you did not include it in your list,san isidro isabela brown not include list,san isidro isabela brown not include list,san isidro isabela brownout not include list,Negative,1,0
29-Mar-24,good not experience frequent blackout,"['It', 'is', 'good', 'because', 'we', 'are', 'not', 'experiencing', 'frequent', 'blackout']","['it', 'is', 'good', 'because', 'we', 'are', 'not', 'experiencing', 'frequent', 'blackout']",it is good because we are not experiencing frequent blackout,good not experiencing frequent blackout,good not experience frequent blackout,good not experience frequent blackout,Positive,0,0.4404
29-Mar-24,average,"['Just', 'an', 'average']","['just', 'an', 'average']",just an average,average,average,average,Neutral,2,0
30-Mar,please also check night power supply low,"['Please', 'also', 'check', 'at', 'night', ',', 'the', 'power', 'supply', 'is', 'very', 'low', '.']","['please', 'also', 'check', 'at', 'night', ',', 'the', 'power', 'supply', 'is', 'very', 'low', '.']",please also check at night  the power supply is very low ,please also check night power supply low,please also check night power supply low,please also check night power supply low,Negative,1,0.0516
31-Mar-24,annoy sometimes power shortage god bless,"['It', 'is', 'annoying', 'sometimes', 'because', 'of', 'power', 'shortage', 'God', 'bless']","['it', 'is', 'annoying', 'sometimes', 'because', 'of', 'power', 'shortage', 'god', 'bless']",it is annoying sometimes because of power shortage god bless,annoying sometimes power shortage god bless,annoy sometimes power shortage god bless,annoy sometimes power shortage god bless,Neutral,2,0
31-Mar-24,service fast especially problem,"['Their', 'services', 'is', 'fast', 'especially', 'when', 'there', 'is', 'a', 'problem']","['their', 'services', 'is', 'fast', 'especially', 'when', 'there', 'is', 'a', 'problem']",their services is fast especially when there is a problem,services fast especially problem,service fast especially problem,service fast especially problem,Positive,0,-0.4576
03-Apr-24,iselco provide good service throughout isabela,"['ISELCO', 'provides', 'good', 'service', 'throughout', 'Isabela']","['iselco', 'provides', 'good', 'service', 'throughout', 'isabela']",iselco provides good service throughout isabela,iselco provides good service throughout isabela,iselco provide good service throughout isabela,iselco provide good service throughout isabela,Positive,0,0.4404
09-Apr-24,considerate term electric bill,"['They', 'are', 'considerate', 'in', 'terms', 'of', 'the', 'electric', 'bill']","['they', 'are', 'considerate', 'in', 'terms', 'of', 'the', 'electric', 'bill']",they are considerate in terms of the electric bill,considerate terms electric bill,considerate term electric bill,considerate term electric bill,Positive,0,0.4404
09-Apr-24,service good customer responsible pay bill time,"['their', 'service', 'is', 'good', 'and', 'as', 'a', 'customer', ',', 'we', 'should', 'be', 'responsible', 'in', 'paying', 'the', 'bills', 'on', 'time']","['their', 'service', 'is', 'good', 'and', 'as', 'a', 'customer', ',', 'we', 'should', 'be', 'responsible', 'in', 'paying', 'the', 'bills', 'on', 'time']",their service is good and as a customer  we should be responsible in paying the bills on time,service good customer responsible paying bills time,service good customer responsible pay bill time,service good customer responsible pay bill time,Positive,0,0.5859
09-Apr-24,collect bill mandate someone collect every house office far,"['when', 'collecting', 'bills', ',', 'they', 'should', 'mandate', 'someone', 'to', 'collect', 'it', 'every', 'house', 'because', 'their', 'office', 'is', 'far']","['when', 'collecting', 'bills', ',', 'they', 'should', 'mandate', 'someone', 'to', 'collect', 'it', 'every', 'house', 'because', 'their', 'office', 'is', 'far']",when collecting bills  they should mandate someone to collect it every house because their office is far,collecting bills mandate someone collect every house office far,collect bill mandate someone collect every house office far,collect bill mandate someone collect every house office far,Neutral,2,0
09-Apr-24,possible brownout do especially night time,"['If', 'possible', ',', 'no', 'brownout', 'will', 'be', 'done', 'especially', 'in', 'night', 'time']","['if', 'possible', ',', 'no', 'brownout', 'will', 'be', 'done', 'especially', 'in', 'night', 'time']",if possible  no brownout will be done especially in night time,possible brownout done especially night time,possible brownout do especially night time,possible brownout do especially night time,Neutral,2,0
09-Apr-24,little bad electricity cut nowhere cause hassle majority people cause disturbance,"['it', 'is', 'a', 'little', 'bad', ',', 'the', 'electricity', 'cuts', 'off', 'out', 'of', 'nowhere', 'and', 'it', 'causes', 'hassle', 'to', 'majority', 'of', 'people', ',', 'it', 'is', 'causing', 'disturbances']","['it', 'is', 'a', 'little', 'bad', ',', 'the', 'electricity', 'cuts', 'off', 'out', 'of', 'nowhere', 'and', 'it', 'causes', 'hassle', 'to', 'majority', 'of', 'people', ',', 'it', 'is', 'causing', 'disturbances']",it is a little bad  the electricity cuts off out of nowhere and it causes hassle to majority of people  it is causing disturbances,little bad electricity cuts nowhere causes hassle majority people causing disturbances,little bad electricity cut nowhere cause hassle majority people cause disturbance,little bad electricity cut nowhere cause hassle majority people cause disturbance,Negative,1,-0.7679
09-Apr-24,bill high possible low hop response,"['The', 'bill', 'is', 'too', 'high', ',', 'if', 'possible', ',', 'they', 'should', 'lower', 'it', ',', 'we', 'are', 'hoping', 'in', 'your', 'response']","['the', 'bill', 'is', 'too', 'high', ',', 'if', 'possible', ',', 'they', 'should', 'lower', 'it', ',', 'we', 'are', 'hoping', 'in', 'your', 'response']",the bill is too high  if possible  they should lower it  we are hoping in your response,bill high possible lower hoping response,bill high possible low hop response,bill high possible low hop response,Negative,1,-0.2732
09-Apr-24,hope low bill per kilowatthour,"['We', 'hope', 'they', 'should', 'lower', 'the', 'bill', 'per', 'kilowatt-hour']","['we', 'hope', 'they', 'should', 'lower', 'the', 'bill', 'per', 'kilowatt-hour']",we hope they should lower the bill per kilowatthour,hope lower bill per kilowatthour,hope low bill per kilowatthour,hope low bill per kilowatthour,Negative,1,0.2023
09-Apr-24,low bill per kilowatthour hope fulfil soon,"['Lower', 'the', 'bill', 'per', 'kilowatt-hour', ',', 'I', 'hope', 'it', 'will', 'be', 'fulfilled', 'soon']","['lower', 'the', 'bill', 'per', 'kilowatt-hour', ',', 'i', 'hope', 'it', 'will', 'be', 'fulfilled', 'soon']",lower the bill per kilowatthour  i hope it will be fulfilled soon,lower bill per kilowatthour hope fulfilled soon,low bill per kilowatthour hope fulfil soon,low bill per kilowatthour hope fulfil soon,Negative,1,0.2023
09-Apr-24,iselco deliver high quality electric service,"['ISELCO', 'delivered', 'a', 'high', 'quality', 'electric', 'service', '.']","['iselco', 'delivered', 'a', 'high', 'quality', 'electric', 'service', '.']",iselco delivered a high quality electric service ,iselco delivered high quality electric service,iselco deliver high quality electric service,iselco deliver high quality electric service,Positive,0,0
09-Apr-24,good service always continue update iselco facebook page u inform,"['Good', 'service', ',', 'always', 'continue', 'to', 'update', 'the', 'ISELCO', 'facebook', 'page', 'for', 'us', 'to', 'be', 'informed']","['good', 'service', ',', 'always', 'continue', 'to', 'update', 'the', 'iselco', 'facebook', 'page', 'for', 'us', 'to', 'be', 'informed']",good service  always continue to update the iselco facebook page for us to be informed,good service always continue update iselco facebook page us informed,good service always continue update iselco facebook page u inform,good service always continue update iselco facebook page u inform,Positive,0,0.4404
09-Apr-24,okay lately experience power shortage want know,"['It', 'is', 'okay', ',', 'lately', 'we', 'are', 'experiencing', 'a', 'power', 'shortage', 'we', 'just', 'want', 'to', 'know', 'why']","['it', 'is', 'okay', ',', 'lately', 'we', 'are', 'experiencing', 'a', 'power', 'shortage', 'we', 'just', 'want', 'to', 'know', 'why']",it is okay  lately we are experiencing a power shortage we just want to know why,okay lately experiencing power shortage want know,okay lately experience power shortage want know,okay lately experience power shortage want know,Positive,0,0.0516
09-Apr-24,iselco need developed upgraded order maintain operating efficiency,"['ISELCO', 'needs', 'to', 'be', 'developed', 'and', 'upgraded', 'in', 'order', 'to', 'maintain', 'it', 'operating', 'efficiency']","['iselco', 'needs', 'to', 'be', 'developed', 'and', 'upgraded', 'in', 'order', 'to', 'maintain', 'it', 'operating', 'efficiency']",iselco needs to be developed and upgraded in order to maintain it operating efficiency,iselco needs developed upgraded order maintain operating efficiency,iselco need developed upgraded order maintain operating efficiency,iselco need developed upgraded order maintain operating efficiency,Positive,0,0.3612
09-Apr-24,promptly inform schedule power outage provide alternative solution iselco,"['Being', 'promptly', 'informed', 'about', 'scheduled', 'power', 'outages', 'and', 'provided', 'with', 'alternative', 'solutions', 'by', 'ISELCO']","['being', 'promptly', 'informed', 'about', 'scheduled', 'power', 'outages', 'and', 'provided', 'with', 'alternative', 'solutions', 'by', 'iselco']",being promptly informed about scheduled power outages and provided with alternative solutions by iselco,promptly informed scheduled power outages provided alternative solutions iselco,promptly inform schedule power outage provide alternative solution iselco,promptly inform schedule power outage provide alternative solution iselco,Positive,0,0.3182
09-Apr-24,provide high quality elctric service,"['Provides', 'a', 'high', 'quality', 'elctric', 'service']","['provides', 'a', 'high', 'quality', 'elctric', 'service']",provides a high quality elctric service,provides high quality elctric service,provide high quality elctric service,provide high quality elctric service,Positive,0,0
09-Apr-24,good not problem since nice service,"['It', 'is', 'good', ',', 'I', 'do', 'not', 'have', 'any', 'problem', 'with', 'them', 'since', 'they', 'have', 'a', 'nice', 'service']","['it', 'is', 'good', ',', 'i', 'do', 'not', 'have', 'any', 'problem', 'with', 'them', 'since', 'they', 'have', 'a', 'nice', 'service']",it is good  i do not have any problem with them since they have a nice service,good not problem since nice service,good not problem since nice service,good not problem since nice service,Positive,0,0.4265
09-Apr-24,good term service early head announcement power outage,"['they', 'are', 'doing', 'good', 'in', 'terms', 'of', 'their', 'service', ',', 'they', 'have', 'an', 'early', 'heads', 'up', 'or', 'announcement', 'if', 'there', 'will', 'be', 'power', 'outage']","['they', 'are', 'doing', 'good', 'in', 'terms', 'of', 'their', 'service', ',', 'they', 'have', 'an', 'early', 'heads', 'up', 'or', 'announcement', 'if', 'there', 'will', 'be', 'power', 'outage']",they are doing good in terms of their service  they have an early heads up or announcement if there will be power outage,good terms service early heads announcement power outage,good term service early head announcement power outage,good term service early head announcement power outage,Positive,0,0.4404
09-Apr-24,good since barely experience power shortage,"['It', 'is', 'just', 'good', 'since', 'we', 'barely', 'experience', 'power', 'shortage']","['it', 'is', 'just', 'good', 'since', 'we', 'barely', 'experience', 'power', 'shortage']",it is just good since we barely experience power shortage,good since barely experience power shortage,good since barely experience power shortage,good since barely experience power shortage,Positive,0,0.2878
09-Apr-24,post notice power interruption electricity already,"['they', 'just', 'posted', 'notice', 'of', 'power', 'interruption', 'when', 'the', 'electricity', 'is', 'already', 'out']","['they', 'just', 'posted', 'notice', 'of', 'power', 'interruption', 'when', 'the', 'electricity', 'is', 'already', 'out']",they just posted notice of power interruption when the electricity is already out,posted notice power interruption electricity already,post notice power interruption electricity already,post notice power interruption electricity already,Negative,1,-0.3612
09-Apr-24,always post notice already late fix kid suffer,"['you', 'always', 'post', 'notice', 'when', 'it', 'is', 'already', 'late', '.', 'Fix', 'it', ',', 'the', 'kids', 'are', 'suffering']","['you', 'always', 'post', 'notice', 'when', 'it', 'is', 'already', 'late', '.', 'fix', 'it', ',', 'the', 'kids', 'are', 'suffering']",you always post notice when it is already late  fix it  the kids are suffering,always post notice already late fix kids suffering,always post notice already late fix kid suffer,always post notice already late fix kid suffer,Negative,1,-0.5423
09-Apr-24,power iselco already third time,"['The', 'power', 'is', 'on', 'and', 'off', 'again', 'ISELCO', ',', 'this', 'is', 'already', 'the', 'third', 'time']","['the', 'power', 'is', 'on', 'and', 'off', 'again', 'iselco', ',', 'this', 'is', 'already', 'the', 'third', 'time']",the power is on and off again iselco  this is already the third time,power iselco already third time,power iselco already third time,power iselco already third time,Negative,1,0
09-Apr-24,electricity go twice every night,"['why', 'does', 'the', 'electricity', 'go', 'out', 'twice', 'every', 'night', '?']","['why', 'does', 'the', 'electricity', 'go', 'out', 'twice', 'every', 'night', '?']",why does the electricity go out twice every night ,electricity go twice every night,electricity go twice every night,electricity go twice every night,Neutral,2,0
09-Apr-24,thank always remind u christmas light,"['Thank', 'you', 'for', 'always', 'reminding', 'us', 'about', 'christmass', ',', 'the', 'lights', 'are', 'on', 'and', 'off']","['thank', 'you', 'for', 'always', 'reminding', 'us', 'about', 'christmass', ',', 'the', 'lights', 'are', 'on', 'and', 'off']",thank you for always reminding us about christmass  the lights are on and off,thank always reminding us christmass lights,thank always remind u christmas light,thank always remind u christmas light,Negative,1,0.3612
09-Apr-24,well iselco,"['You', 'are', 'doing', 'so', 'well', 'ISELCO']","['you', 'are', 'doing', 'so', 'well', 'iselco']",you are doing so well iselco,well iselco,well iselco,well iselco,Positive,0,0.2732
09-Apr-24,light,"['No', 'lights', 'again']","['no', 'lights', 'again']",no lights again,lights,light,light,Negative,1,0
09-Apr-24,please check power supply low destroyed fridge last night,"['Please', 'check', 'the', 'power', 'supply', ',', 'it', 'is', 'so', 'low', ',', 'it', 'destroyed', 'our', 'fridge', 'last', 'night']","['please', 'check', 'the', 'power', 'supply', ',', 'it', 'is', 'so', 'low', ',', 'it', 'destroyed', 'our', 'fridge', 'last', 'night']",please check the power supply  it is so low  it destroyed our fridge last night,please check power supply low destroyed fridge last night,please check power supply low destroyed fridge last night,please check power supply low destroyed fridge last night,Negative,1,-0.4588
09-Apr-24,two day without light,"['Two', 'days', 'without', 'lights', ',', 'what', 'is', 'that', '?']","['two', 'days', 'without', 'lights', ',', 'what', 'is', 'that', '?']",two days without lights  what is that ,two days without lights,two day without light,two day without light,Neutral,2,0
09-Apr-24,iselco still electricity roxas,"['What', 'now', 'ISELCO', '?', 'Still', 'no', 'electricity', 'here', 'in', 'Roxas']","['what', 'now', 'iselco', '?', 'still', 'no', 'electricity', 'here', 'in', 'roxas']",what now iselco  still no electricity here in roxas,iselco still electricity roxas,iselco still electricity roxas,iselco still electricity roxas,Negative,1,0
09-Apr-24,little rain power already,"['Just', 'a', 'little', 'rain', 'and', 'the', 'power', 'is', 'already', 'out']","['just', 'a', 'little', 'rain', 'and', 'the', 'power', 'is', 'already', 'out']",just a little rain and the power is already out,little rain power already,little rain power already,little rain power already,Negative,1,0
09-Apr-24,bad little wind mist brownout immediately,"['You', 'are', 'bad', ',', 'a', 'little', 'wind', 'and', 'mist', 'brownout', 'immediately']","['you', 'are', 'bad', ',', 'a', 'little', 'wind', 'and', 'mist', 'brownout', 'immediately']",you are bad  a little wind and mist brownout immediately,bad little wind mist brownout immediately,bad little wind mist brownout immediately,bad little wind mist brownout immediately,Negative,1,-0.5423
09-Apr-24,brown every day let u expect big bill,"['Brown', 'out', 'every', 'day', ',', 'let', 'us', 'expect', 'a', 'big', 'bill']","['brown', 'out', 'every', 'day', ',', 'let', 'us', 'expect', 'a', 'big', 'bill']",brown out every day  let us expect a big bill,brown every day let us expect big bill,brown every day let u expect big bill,brownout every day let u expect big bill,Neutral,2,0
10-Apr-24,service instantly,"['The', 'service', 'is', 'instantly']","['the', 'service', 'is', 'instantly']",the service is instantly,service instantly,service instantly,service instantly,Positive,0,0
10-Apr-24,thank iselco fast repair answer call,"['Thank', 'you', 'Iselco', 'for', 'the', 'fast', 'repair', 'and', 'for', 'answering', 'the', 'call', '.']","['thank', 'you', 'iselco', 'for', 'the', 'fast', 'repair', 'and', 'for', 'answering', 'the', 'call', '.']",thank you iselco for the fast repair and for answering the call ,thank iselco fast repair answering call,thank iselco fast repair answer call,thank iselco fast repair answer call,Positive,0,0.3612
14-Apr-24,thank clarification,"['Thank', 'you', 'for', 'the', 'clarification', '.']","['thank', 'you', 'for', 'the', 'clarification', '.']",thank you for the clarification ,thank clarification,thank clarification,thank clarification,Positive,0,0.3612
14-Apr-24,always brownout night child pitiful mercy,"['it', 'is', 'always', 'a', 'brownout', 'at', 'night', '.', 'The', 'children', 'are', 'pitiful', 'have', 'mercy']","['it', 'is', 'always', 'a', 'brownout', 'at', 'night', '.', 'the', 'children', 'are', 'pitiful', 'have', 'mercy']",it is always a brownout at night  the children are pitiful have mercy,always brownout night children pitiful mercy,always brownout night child pitiful mercy,always brownout night child pitiful mercy,Negative,1,-0.1779
14-Apr-24,notice brownout every hour brownout not schedule,"['We', 'all', 'have', 'notices', 'of', 'brownouts', ',', 'every', 'hour', 'it', 'is', 'brownout', 'that', 'does', 'not', 'have', 'a', 'schedule', '.']","['we', 'all', 'have', 'notices', 'of', 'brownouts', ',', 'every', 'hour', 'it', 'is', 'brownout', 'that', 'does', 'not', 'have', 'a', 'schedule', '.']",we all have notices of brownouts  every hour it is brownout that does not have a schedule ,notices brownouts every hour brownout not schedule,notice brownout every hour brownout not schedule,notice brownout every hour brownout not schedule,Negative,1,0
16-Apr-24,lender unable pay price bill,"['The', 'lender', 'is', 'unable', 'to', 'pay', 'the', 'price', 'of', 'the', 'bill', '.']","['the', 'lender', 'is', 'unable', 'to', 'pay', 'the', 'price', 'of', 'the', 'bill', '.']",the lender is unable to pay the price of the bill ,lender unable pay price bill,lender unable pay price bill,lender unable pay price bill,Negative,1,-0.1027
16-Apr-24,electric bill suddenly soar high,"['The', 'electric', 'bill', 'suddenly', 'soared', 'high']","['the', 'electric', 'bill', 'suddenly', 'soared', 'high']",the electric bill suddenly soared high,electric bill suddenly soared high,electric bill suddenly soar high,electric bill suddenly soar high,Negative,1,0
16-Apr-24,not surprised hot bill go cold bill go,"['Do', 'not', 'be', 'surprised', 'when', 'it', 'is', 'hot', 'and', 'the', 'bill', 'goes', 'up', ';', 'when', 'it', 'is', 'cold', ',', 'the', 'bill', 'goes', 'down', '.']","['do', 'not', 'be', 'surprised', 'when', 'it', 'is', 'hot', 'and', 'the', 'bill', 'goes', 'up', ';', 'when', 'it', 'is', 'cold', ',', 'the', 'bill', 'goes', 'down', '.']",do not be surprised when it is hot and the bill goes up  when it is cold  the bill goes down ,not surprised hot bill goes cold bill goes,not surprised hot bill go cold bill go,not surprised hot bill go cold bill go,Neutral,2,-0.1695
